filename,Names,Nouns,Organizations,Text,Verbs
ACS_Cent_Sci/PMC5532721.nxml,Jonas C. Peters,group;members;group;contributions;research;program,,"All group members past and present, as well as Prof.
Jonas C. Peters and his group, are gratefully acknowledged for their
contributions to this research program.",acknowledge
ACS_Cent_Sci/PMC5532715.nxml,Allen Goldstein;Lindsay Yee,discussions,UC Berkeley,"We thank Prof. Allen Goldstein and Dr. Lindsay Yee (UC Berkeley) for
helpful discussions.",thank
ACS_Cent_Sci/PMC5532720.nxml,C. Ong; Ti-CB,measurements;compound,"NMR
","Dr. T.-C. Ong is acknowledged for preliminary NMR
measurements
on a related compound to  Ti-CB .",acknowledge
ACS_Cent_Sci/PMC5532707.nxml,Linxi Zhang;Chung-Chueh Chang,help;cryo;TEM;imaging,,"We would like to thank
Linxi Zhang and Dr. Chung-Chueh Chang for help with cryo-TEM imaging.
",like;thank
ACS_Cent_Sci/PMC5532707.nxml,Oleg Gang;Dmytro Nykypanchuk;Suchetan Pal;Xiaobing Zuo;Olivier Taché,help;measurements,"USAXS
","Dr. Oleg Gang, Dmytro Nykypanchuk, Suchetan Pal, Xiaobing Zuo, and
Dr. Olivier Taché are acknowledged for help in SAXS and USAXS
measurements, respectively.",xiaob;acknowledge
ACS_Cent_Sci/PMC5532707.nxml,Markus Bleuel;Vitaliy Pipich,measurements;assistance,VSANS,"The SANS and VSANS measurements were conducted
with the assistance of Dr. Markus Bleuel and Dr. Vitaliy Pipich.",conduct
ACS_Cent_Sci/PMC5532707.nxml,Arthur J. Autz;Jeffrey W. Kysar,help;preparation;samples;tests;help;toughness;measurements,,"We
would also like to thank Arthur J. Autz for help in preparation of
the prenotched samples for SEN-3PB tests and Prof. Jeffrey W. Kysar
for help in toughness measurements.",like;thank
ACS_Cent_Sci/PMC5532707.nxml,Jack Douglas;Guruswamy Kumaraswamy;Sylvain Deville;Thomas Russell,authors,,"The authors thank Dr. Jack Douglas,
Dr. Guruswamy Kumaraswamy, Dr. Sylvain Deville, Prof. Thomas Russell,
",thank
ACS_Cent_Sci/PMC5532707.nxml,Mary Boyce;George Floudas;Richard A. Vaia;Michael Rubinstein,A.;discussions;comments;manuscript,,"Prof. Mary Boyce, Dr. George Floudas, Dr. Richard A. Vaia, Prof. James
Runt, and Prof. Michael Rubinstein for many useful discussions and
also for comments on this manuscript.",
ACS_Cent_Sci/PMC5532724.nxml,S. Malstrom;W. Huang,support,"the Koch Institute Swanson Biotechnology Center
","We thank the Koch Institute Swanson Biotechnology Center
for technical support, specifically Dr. S. Malstrom and Ms. W. Huang.
",thank
ACS_Cent_Sci/PMC5532724.nxml,A. Detappe;Dr. P. Ghoroghchian,discussions;consultations,,"We thank Dr. A. Detappe and Dr. P. Ghoroghchian for very fruitful
discussions and consultations.",thank
ACS_Cent_Sci/PMC5571458.nxml,"Arman Boromand;Safa Jamali;
Katie M. Weigandt",discussions;work;help;neutron;studies,NIST,"We would
like to thank Dr. Arman Boromand and Dr. Safa Jamali for the fruitful
discussions regarding the computational part of this work and Dr.
Katie M. Weigandt (NIST) for help with the neutron scattering studies.",thank;scatter
ACS_Cent_Sci/PMC5571459.nxml,Thomas Peterson,analysis;discussion,"Dow
Chemicals;GPC;DSC","We thank Dr. Ruth
Figueroa and Dr. Thomas Peterson at Dow
Chemicals for GPC and DSC analysis and useful discussion.",thank
ACS_Cent_Sci/PMC5571459.nxml,Elisabeth Irran;Eva Nichols,measurement;X;ray;diffraction;help;analysis,CV,"Dr. Elisabeth Irran for the measurement of the X-ray diffraction and
Eva Nichols for help with the CV analysis.",
ACS_Cent_Sci/PMC5571457.nxml,Marcus Kim,authors;support;staff;clinics,"the Faculty of Science
and Health Sciences;McMaster University;Agilent
Technologies Inc.;CF clinics;McMaster Children’s
Hospital;the Hospital for Sick Children","The authors acknowledge
support from the Faculty of Science
and Health Sciences at McMaster University, Dr. Marcus Kim from Agilent
Technologies Inc., and staff from CF clinics at McMaster Children’s
Hospital and the Hospital for Sick Children.",acknowledge
ACS_Cent_Sci/PMC5571454.nxml,D.L.J. B.,support,"The Netherlands
Organization for Scientific Research (","D.L.J. B. acknowledges the support from The Netherlands
Organization for Scientific Research (Rubicon Postdoctoral Fellowship
680-50-1517).",acknowledge
ACS_Cent_Sci/PMC5571454.nxml,Jonas Karosas,authors;assistance;measurements,ICP,"The authors also thank Jonas Karosas for assistance
with ICP-MS measurements.",thank
ACS_Cent_Sci/PMC5833012.nxml,Lady Sobell;Academic Chair,holder,I.M.,"I.M. is holder of the Sir Michael and Lady Sobell Academic Chair.
",
ACS_Cent_Sci/PMC5620980.nxml,Johannes M. Dieterich;Nari Baughman,FA9550;FA9550;manuscript,,"FA9550-10-1-0572
and FA9550-14-1-0254 and are grateful to Dr. Johannes M. Dieterich
and Nari Baughman for helping to revise the manuscript.",help;revise
ACS_Cent_Sci/PMC5620981.nxml,Henry Dale Fellowship,,Y.F.;Wellcome Trust,"Y.F. acknowledges
a Wellcome Trust Sir Henry Dale Fellowship (100104/Z/12/Z).",acknowledge
ACS_Cent_Sci/PMC5620981.nxml,Ian Dransfield,authors;discussions;advice;support,"University of Edinburgh;the Confocal Advanced Light Microscopy;the
University of Edinburgh","The authors thank Prof. Ian Dransfield (University of Edinburgh) for
helpful discussions and advice and are thankful for the technical
support from the Confocal Advanced Light Microscopy (CALM) at the
University of Edinburgh.",thank
ACS_Cent_Sci/PMC5620983.nxml,Simon B. Blakey;Justin Du Bois;Mo Movassaghi;Djamaladdin G. Musaev;David H. Sherman;Jin-Quan Yu,leaders;vision;leadership;members;community;level;engagement;enthusiasm,,"We
thank the thematic leaders, Simon B. Blakey, Justin Du Bois, Mo Movassaghi,
Djamaladdin G. Musaev, David H. Sherman, and Jin-Quan Yu, for their
vision and leadership and all of the members of the CCHF community
for their tremendous level of engagement and enthusiasm.",thank
ACS_Cent_Sci/PMC5620987.nxml,Tonya Gilbert;Johanna Rokka;Yvonne Klingl;Nicole Zurcher,discussions;assistance;work,"Hsiao-Ying
Wey","We thank
Tonya Gilbert, Johanna Rokka, Yvonne Klingl, Hsiao-Ying
Wey, and Nicole Zurcher for helpful discussions and assistance with
experimental work.",thank
ACS_Cent_Sci/PMC5620987.nxml,Jerome Lyle Rappaport MGH,A.;resource;support;instrumentation;S10RR022976;S10RR019933,"the U.S. Department of
Energy (DE-SC0008430;the National Center for Research Resources;Biomedical Imaging;NIH;Grants S10RR029495;S10RR023401","We acknowledge the U.S. Department of
Energy (DE-SC0008430), the Phyllis and Jerome Lyle Rappaport MGH Research
Scholar Award, the National Center for Research Resources (P41RR14075),
and the Athinoula A. Martinos Center for Biomedical Imaging for resource
support, including through NIH shared instrumentation Grants S10RR029495,
1S10RR017208-01A1, 1S10RR015728-01, S10RR022976, S10RR019933, and
S10RR023401.",acknowledge;include;share
ACS_Cent_Sci/PMC5620982.nxml,"Jun Xu;Chang Yan
",advice;support;experiments;help;reflection;studies;help;studies,NMR;FTIR,"We also
thank Jun Xu for advice and support on NMR experiments, Chang Yan
for help on the external reflection FTIR studies, and Dr. Jayeon Baek
for help on the XPS studies.",thank
ACS_Cent_Sci/PMC5621004.nxml,Shao-Liang Zheng;Rocco Policarpo,help;X;ray;help;purification,Harvard;Harvard;HPLC,"We thank Dr. Shao-Liang Zheng (Harvard)
for help with the X-ray and Rocco Policarpo (Harvard) for help with
HPLC purification.",thank
ACS_Cent_Sci/PMC5620978.nxml,Anthony Ayala;Kathy Schaefer,assistance;scale;intermediates;assistance;cell;culture,,"We thank Anthony Ayala (Janelia) for assistance in
the scale-up
of synthetic intermediates and Kathy Schaefer (Janelia) for assistance
with cell culture.",thank
ACS_Cent_Sci/PMC5620968.nxml,Mark Lonergan,,,"We also thank Professor Mark Lonergan and Dr. Fuding
",thank
ACS_Cent_Sci/PMC5620970.nxml,Dorothea Buckler,thanks;support,,"C.N. thanks Sheldon and Dorothea Buckler for their generous support.
",
ACS_Cent_Sci/PMC5658758.nxml,P30 CA023168,,,(P30 CA023168).,
ACS_Cent_Sci/PMC5658761.nxml,Franklin Lee,reading;feedback;manuscript,,"We thank Franklin Lee for critical reading and feedback
on
the manuscript.",thank
ACS_Cent_Sci/PMC5658761.nxml,Anders G. Frøseth,support;work;machine;learning,,"We acknowledge
the generous support of Dr. Anders G. Frøseth and Mr. Christian
Sundt for our work on machine learning.",acknowledge
ACS_Cent_Sci/PMC5658750.nxml,Welch Foundation Grant,support,,"Financial support
by Welch Foundation Grant",
ACS_Cent_Sci/PMC5658750.nxml,Yu Lai;Wangda Li,author;assistance;figures,,"The author thanks Dr. Sheng-Heng Chung,
Ke-Yu Lai, and Wangda Li for their assistance with the figures.",thank
ACS_Cent_Sci/PMC5658760.nxml,Frank Bates;Mike Larsen;Stacey A. Saba;Morgan Schulze;Philip Dirlam;Bongjoon Lee;Wei Zhang,authors;A.;discussions;input;help;experiments;TEM;sample;preparation;TEM;imaging,Sujay Chopade;TEM;TEM,"The authors thank Prof. Frank Bates, Sujay Chopade,
Dr. Mike Larsen, Stacey A. Saba, and Dr. Morgan Schulze for helpful
discussions and input, Dr. Philip Dirlam for help with some of the
curing experiments, Dr. Bongjoon Lee for TEM sample preparation, and
Dr. Wei Zhang for TEM imaging.",thank;cure
ACS_Cent_Sci/PMC5658757.nxml,Pouria Dasmeh,discussions;methods;energy;changes;mutations;tree;reconstruction,S.V.,"S.V. would like to
thank Pouria Dasmeh and Adrian Serohijos
for their interesting discussions on methods to compute the free energy
changes for mutations and phylogenetic tree reconstruction.",like;thank;compute
ACS_Cent_Sci/PMC5658757.nxml,Nicolas Sawaya,authors;code;calculation;charges;transition;densities,,"The authors
thank Nicolas Sawaya for sharing his code for the calculation of atomic
partial charges from the transition densities.",thank;share
ACS_Cent_Sci/PMC5658755.nxml,Sai Reddy;Wenjing Wang;Jennifer Hou,help;laser;irradiation;experiments;help;fluorometer;measurements;help;titrations,"
S. Nitya;the Lu Research
Group;Varun Mohan
;the Jain Research Group;the Burke Group;ITC","We thank
S. Nitya Sai Reddy and Wenjing Wang of the Lu Research
Group for their help in the laser irradiation experiments, Varun Mohan
of the Jain Research Group for his help with fluorometer measurements,
and Jennifer Hou of the Burke Group for her help in the ITC titrations.
",thank
ACS_Cent_Sci/PMC5658752.nxml,"H. Alex Brown;Robert A. DiStasio Jr.;Megan Gelsinger
;Michael Frohman;Jeremy Thorner",facility;DBI-1428922;assistance;analysis;laboratories;plasmids;discussions,"the Cornell University NMR;NSF;the Cornell Biotechnology Resource Center Imaging Facility;NSF;Vanderbilt University;Cornell University;Stony
Brook University;University of California, Berkeley)
","We thank the Cornell University NMR facility (NSF MRI: CHE-1531632),
the Cornell Biotechnology Resource Center Imaging Facility (NSF MRI:
DBI-1428922), H. Alex Brown (Vanderbilt University) for providing
VU0359595 and VU0364739, Robert A. DiStasio Jr. and Megan Gelsinger
for assistance with statistical analysis, the Baird, Mao, and Yu laboratories
(Cornell University) for providing plasmids, and Michael Frohman (Stony
Brook University) and Jeremy Thorner (University of California, Berkeley)
for helpful discussions.",thank;provide;provide
ACS_Cent_Sci/PMC5704292.nxml,Jeffery F. Miller,discussions;analysis,,"We thank
Dr. Jeffery F. Miller for helpful discussions regarding
the phylogenetic analysis.",thank
ACS_Cent_Sci/PMC5704290.nxml,Prof J. Blanchard;Tiago Rodrigues,gene;analysis,,"We thank
Prof J. Blanchard for supplying the gene for wt-PanC in plasmid and
Dr. Tiago Rodrigues for initial structural analysis.",thank;supply
ACS_Cent_Sci/PMC5704293.nxml,Javier Soutres,assistance;FRAP;experiments;discussions,Linköping University;FRAP;AFM,"We are grateful to Thomas
Ederth, Linköping University, and to Javier Soutres (Malmö
University) for assistance with the FRAP and AFM experiments respectively
and for helpful discussions.",
ACS_Cent_Sci/PMC5704293.nxml,Kishore Kumar Jagadeesan;Eglė Malcaitė;Eglė Pakalnytė;Vivek Chaturverdi;Madhuri Nagabhushanam,assistance,Lund University;Malmö University,"Kishore Kumar Jagadeesan (Lund University),
Guoqing Pan, Eglė Malcaitė, Eglė Pakalnytė,
Vivek Chaturverdi, and Madhuri Nagabhushanam, Malmö University,
are acknowledged for experimental assistance.",acknowledge
ACS_Cent_Sci/PMC5704285.nxml,"Cyrille Costentin
;Jo Melville",authors;discussions,,"The authors gratefully
acknowledge Prof. Cyrille Costentin
and Jo Melville for many helpful discussions.",acknowledge
ACS_Cent_Sci/PMC5704284.nxml,Roald Hoffmann;Yen Chen;Hao Shen,access;facilities;comments;codes;assistance;setups,,"We thank Roald Hoffmann for access to computational
facilities and comments, Tai-Yen Chen for providing Matlab codes,
and Xiaochun Zhou and Hao Shen for assistance in microscopy setups.
",thank;provide
ACS_Cent_Sci/PMC5704294.nxml,Grace Wilsey;Kevin Lee;Jonathan Weissman;Theresa McLaughlin;Peter Cresswell,discussions;cell;lines;plasmids;facility;sample;analysis;gift;reporter,"the
Stanford University Mass Spectrometry","We thank Matt, Kristen,
and Grace Wilsey, Kevin Lee, and Ray
Deshaies for foundational discussions, Jonathan Weissman for providing
dCas9-KRAB cell lines and sgRNA plasmids, Theresa McLaughlin at the
Stanford University Mass Spectrometry facility for sample analysis,
and Peter Cresswell for the gift of the ddVenus reporter.",thank;provide
ACS_Cent_Sci/PMC5833006.nxml,Keck Electron Microscopy;Nanostructures Laboratory,authors;support;measurements,SEM;AFM,"The authors acknowledge the support of NSF-CHE 1506839 (T.E.) and
the W.M. Keck Electron Microscopy for SEM and Nanostructures Laboratory
for AFM measurements.",acknowledge
ACS_Cent_Sci/PMC5746868.nxml,"ENS de Lyon;Summer Baker-Dockrey
;Devin Ferguson",authors;assistance,Emma Gendre;University of Michigan;University of Michigan,"The authors
acknowledge assistance from Emma Gendre (ENS de Lyon), Summer Baker-Dockrey
(University of Michigan), and Devin Ferguson (University of Michigan).",acknowledge
ACS_Cent_Sci/PMC5746861.nxml,Abelardo Ramirez-Hernandez;Chris Chipot,help;dynamics;simulations;discussions;diffusion;calculations,,"We would
like to thank Dr. Abelardo Ramirez-Hernandez for
his help with performing some of the molecular dynamics simulations
and Dr. Chris Chipot for useful discussions on the Smoluchowski diffusion
calculations.",thank;perform
ACS_Cent_Sci/PMC5746862.nxml,Brendan Zhang,luciferin;docking;studies;members;laboratories;reagents,Weiss;Martin,"We thank
Brendan Zhang for assisting with luciferin docking studies, along
with members of the Weiss and Martin laboratories for reagents.",thank;assist
ACS_Cent_Sci/PMC5746862.nxml,Aaron Leconte,members;laboratory;discussions,Claremont-McKenna,"We
also thank Prof. Aaron Leconte (Claremont-McKenna) and members of
the Prescher laboratory for helpful discussions.",thank
ACS_Cent_Sci/PMC5746865.nxml,Jay Nix,assistance;X;ray;diffraction;data;collection,ALS,"We
thank Jay Nix and ALS Beamline 4.2.2 for assistance with X-ray diffraction
data collection.",thank
ACS_Cent_Sci/PMC5746856.nxml,Carsten Mim,protein,Northwestern University,"We are grateful to Carsten Mim and
Vinzenz Unger of Northwestern University for generously providing
us with the protein.",provide
ACS_Cent_Sci/PMC5746856.nxml,John M. A. Grime,members;group;discussions,,"We thank all the members of the Voth group for
fruitful discussions, especially John M. A. Grime.",thank
ACS_Cent_Sci/PMC5746858.nxml,Sebastian Doniach;Nicholas Melosh;Gerald Fuller,discussions,,"We thank Sebastian Doniach, Nicholas Melosh,
and Gerald Fuller for useful discussions.",thank
ACS_Cent_Sci/PMC5746864.nxml,Christoph Grundner;Haya Jamali;Rebecca Wissner,protein;assistance;expression;purification;STEP;assistance;protein;mass;spectrometry;experiments,"University of Washington)
;PTPA;Yale University;STEP;Yale University)
","We thank
Dr. Christoph Grundner (University of Washington)
for generously providing  m PTPA protein and plasmid,
Dr. Haya Jamali (Yale University) for assistance with the expression
and purification of STEP, and Dr. Rebecca Wissner (Yale University)
for assistance with protein mass spectrometry experiments.",thank;provide
ACS_Cent_Sci/PMC5746860.nxml,LEO Pharma,support;work;S10OD016357,"Financial
;NIH;S10OD016357","Financial
support for this work was provided by
LEO Pharma and the NIH (CA132630 and S10OD016357).",provide
ACS_Cent_Sci/PMC5746860.nxml,Martin Stahlhut,support;characterization;compounds;probes,,"We thank Martin Stahlhut for logistical support in biochemical
characterization of various compounds and probes.",thank
ACS_Cent_Sci/PMC5746857.nxml,"
Benjamin Van Roy",thanks;discussions,,"Z.Z. thanks Prof.
Benjamin Van Roy for valuable discussions.",
ACS_Cent_Sci/PMC5746853.nxml,Grant No,C.K.;support;program;No,"the NSF Graduate Research Fellowship
","C.K. acknowledges support from the NSF Graduate Research Fellowship
program under Grant No.",acknowledge
ACS_Cent_Sci/PMC5746855.nxml,Arnold Rheingold;Curtis Moore,conversations;support;X;ray;analysis,,"We thank Keary Engle for helpful conversations, Min Cho for
technical support, and Arnold Rheingold, Curtis Moore, and Milan Gembicky
for X-ray crystallographic analysis.",thank
ACS_Cent_Sci/PMC5785775.nxml,H. Chen;O. Engkvist;G. Klambauer,discussions;manuscript;suggestions,,"We thank H. Chen and O. Engkvist for valuable discussions and feedback
on the manuscript, and G. Klambauer for helpful suggestions.",thank;feedback
ACS_Cent_Sci/PMC5785774.nxml,Kazuhiro Irie,peptide;assays,,"We acknowledge
Professor Kazuhiro Irie for generously
providing synthetic PKCδ-C1b peptide for preliminary binding
assays.",acknowledge;provide
ACS_Cent_Sci/PMC5785766.nxml,Jonathan Moffat;Daniel Lester,measurements;measurements;dextran;polymers,"Asylum Research;Oxford Instruments;AFM;University
of Warwick;SEC","Jonathan Moffat (Asylum Research, Oxford Instruments)
is thanked for liquid AFM measurements, and Daniel Lester (University
of Warwick) is acknowledged for SEC measurements of dextran polymers.",thank;acknowledge
ACS_Cent_Sci/PMC5785769.nxml,Open Babel,developers;source;cheminformatics;tools,RDKit,"We are grateful to
the developers of the open-source cheminformatics
tools Open Babel and RDKit.",
ACS_Cent_Sci/PMC5785761.nxml,Daniel G. Stroppa;Binjie Wang,company,FEI,"We are also grateful for Dr. Daniel G. Stroppa and
Dr. Binjie Wang from FEI company,",
ACS_Cent_Sci/PMC5785761.nxml,Qiang Zhang;Lianshan Sun,,"Tsinghua
University;Institute of Applied Chemistry
Chinese Academy of Sciences","Prof. Qiang Zhang from Tsinghua
University, and Dr. Lianshan Sun from Institute of Applied Chemistry
Chinese Academy of Sciences.",
ACS_Cent_Sci/PMC5785765.nxml,Qiran Xiao,discussion;properties;analysis,"Department
of Materials Science and Engineering;Stanford University","Mr. Qiran Xiao (Department
of Materials Science and Engineering, Stanford University) is acknowledged
for helpful discussion in mechanical properties analysis.",acknowledge
ACS_Cent_Sci/PMC5785770.nxml,Kaiwu Dong;Florian Weniger,team;support;discussion,,"We also thank the analytical
team for kind support and the insightful discussion with Dr. Chaoren
Shen, Dr. Kaiwu Dong, and Florian Weniger.",thank
ACS_Cent_Sci/PMC5785771.nxml,Sheng Zhang;Ievgen Motorykin,help;experiments,MS Facility of Cornell University,"We thank Dr. Sheng Zhang and Dr. Ievgen Motorykin at the
Proteomic and MS Facility of Cornell University for help with the
SILAC experiments.",thank
ACS_Cent_Sci/PMC5833003.nxml,Li Chen,gene;sfGFP(S147C;discussions,,"Tz-Li Chen is thanked for preparing the pBAD
plasmid encoding the gene for sfGFP(S147C) and for helpful discussions.
",thank;prepare;encode
ACS_Cent_Sci/PMC5833003.nxml,Raphael Hofmann,pET28b(+;encoding;gene;discussions,,"Raphael Hofmann is thanked for providing the pET28b(+) plasmid encoding
the gene for Ubc9(C93A) and for helpful discussions.",thank;provide
ACS_Cent_Sci/PMC5833003.nxml,Takahiro Hayashi;Iain Stepek,discussions,,"Dr. Takahiro Hayashi and Iain Stepek are thanked for helpful
discussions.",thank
ACS_Cent_Sci/PMC5833003.nxml,Bertran Gerrits,service;für;spectrometry;analyses,the Laboratorium für Organische Chemie;the Functional Genomic Center Zürich,"We thank Dr. Bertran Gerrits and the MS
service of the Laboratorium für Organische Chemie at ETH Zürich
and the Functional Genomic Center Zürich for mass spectrometry
analyses.",thank
ACS_Cent_Sci/PMC5833007.nxml,Award DE-SC0015959,support,"A.A.G.
;The Department of Energy, Office of Basic
Energy Sciences","A.A.G.
acknowledges support from The Department of Energy, Office of Basic
Energy Sciences under Award DE-SC0015959.",acknowledge
ACS_Cent_Sci/PMC5833007.nxml,Anders Frøseth,support;work,,"We thank Dr. Anders Frøseth
for his generous support of this work.",thank
ACS_Cent_Sci/PMC5833004.nxml,Claudia Jessen,help;FRAP;experiments,FRAP,"We would like to thank Dr. Claudia Jessen-Trefzer
for her invaluable help in cloning the plasmid for FRAP experiments.
",like;thank;clone
ACS_Cent_Sci/PMC5833004.nxml,Isabel Córdoba;Charel Prost,work;preparation;ligands,,"Isabel Córdoba and Charel Prost are also acknowledged for preliminary
work on the preparation of some of the ligands.",acknowledge
ACS_Cent_Sci/PMC5832997.nxml,Mary Gilles;Suzane S. de Sá;Yuemei Han;Xue Bai;Jiaxi Cui,discussion;assistance;experiments,"
Onye Ahanotu","Mary Gilles, Suzane S. de Sá,
Yuemei Han, Xue Bai,
Onye Ahanotu, and Jiaxi Cui provided helpful discussion and assistance
with some experiments.",provide
ACS_Cent_Sci/PMC5833000.nxml,"Nikki Gilbert;Brian Miller;Alexandra
Van Hall-Beauvais;Brian Crane",Professors;guidance;zebrafish;techniques;transfer;laboratory;assistance;fish;husbandry;breeding;assistance;cell;protein;stability;protein;laboratory;use;CD;spectrometer;husbandry;microinjection;imaging;facility,"Professors
Todd Evans;Weill Cornell Medicine;Cornell University","Professors
Todd Evans (Weill Cornell Medicine) and
Joseph Fetcho (Cornell University) for early guidance and zebrafish
techniques transfer; Nikki Gilbert and Brian Miller from the Fetcho
laboratory for assistance with fish husbandry and breeding; Dr. Xuyu
Liu for assistance with cell-based protein stability assays; Alexandra
Van Hall-Beauvais for providing recombinant purified His 6 -Halo protein; Professor Brian Crane’s laboratory for the
use of CD spectrometer; zebrafish husbandry and microinjection/imaging
facility",base;assay;provide;purify
ACS_Cent_Sci/PMC5833000.nxml,R. M. Williams,instrumentation,NIH;Cornell University,"[NIH 1S10RR025502, R. M. Williams (Cornell University)] for instrumentation.
",
ACS_Cent_Sci/PMC5833010.nxml,Tsuyoshi Nakagawa,pGWB605,,"We thank Dr. Tsuyoshi Nakagawa
for providing pGWB605.
",thank;provide
ACS_Cent_Sci/PMC5832995.nxml,Shaul Mukamel,thanks;discussions,,A.A.-G. thanks Shaul Mukamel for useful discussions.,
ACS_Cent_Sci/PMC5832993.nxml,A. A. Gorfe;Project MCB150054,A.;discussion;center;resources,"the Ohio Super Computer;the Extreme Science and Engineering Discovery
Environment;XSEDE","We thank A. A. Gorfe for helpful discussion
and the Ohio Super Computer center located in Columbus, Texas Advanced
Computing Center (TACC), and the Extreme Science and Engineering Discovery
Environment (XSEDE; Project MCB150054) for computational resources.
",thank;locate
ACS_Cent_Sci/PMC5832993.nxml,Grant R01GM116961,time,"Anton2 Computer;the Pittsburgh Supercomputing
Center (;PSC;the National Institutes
of Health","Anton2 Computer time was provided by the Pittsburgh Supercomputing
Center (PSC) through Grant R01GM116961 from the National Institutes
of Health.",provide;r01gm116961
ACS_Cent_Sci/PMC5968442.nxml,Gene Supercomputers,simulations;house;facility,IBM;XSEDE;NSF Project,"The simulations
were performed using in-house IBM Blue Gene Supercomputers (P.D.),
XSEDE facility (NSF Project",perform
ACS_Cent_Sci/PMC5968442.nxml,Srirupa Chakraborty,authors;assistance, Figure,The authors thank Srirupa Chakraborty for assistance with making  Figure  4 .,thank;make
ACS_Cent_Sci/PMC5879474.nxml,"Nick Suhar
",authors;assistance;preparation,,"The authors thank Nick Suhar
for assistance in the preparation of Figure 1.",thank
ACS_Cent_Sci/PMC5879473.nxml,Steven Weigand,assistance;setup;data;reduction,"
of DND-CAT","We thank Steven Weigand
of DND-CAT for assistance with the SAXS setup and data reduction.
",thank
ACS_Cent_Sci/PMC5879473.nxml,Soenke Seifert,assistance;setup;spectroscopy;measurements;support,Northwestern University;NSF,"We thank
Soenke Seifert at Sector 12 for his assistance with the SAXS setup
at Sector 12ID-C. Mass spectroscopy (MALDI) measurements were made
at IMSERC at Northwestern University, which has received support from
the Soft and Hybrid Nanotechnology Experimental Resource (NSF ECCS-1542205);
",thank;receive
ACS_Cent_Sci/PMC5879476.nxml,Y. Wu,,"the Fulbright Scholar Program;a Fellowship
;the NU International Institute of Nanotechnology;a Ryan Fellowship","Y. Wu thanks the Fulbright Scholar Program for a Fellowship
and the NU International Institute of Nanotechnology for a Ryan Fellowship.",thank
ACS_Cent_Sci/PMC5879468.nxml,A.C. M.W.,summer;fellowship;thanks;fellowship,"the USC Wrigley Institute
;the Resnick Sustainability Institute","We are grateful to the USC Wrigley Institute
for a Norma and Jerol Sonosky summer fellowship to A.C. M.W. thanks
the Resnick Sustainability Institute for a postdoctoral fellowship.
",
ACS_Cent_Sci/PMC5879475.nxml,K. Hofmann;E. Settels,authors;help;immunization;experiments;measurements;support,MALDI/TOF-MS,"The authors thank K. Hofmann for valuable
help during passive
immunization experiments and E. Settels for MALDI/TOF-MS measurements
and excellent technical support.",thank
ACS_Cent_Sci/PMC5879475.nxml,S. Hammerschmidt,strains,"Universität Greifswald;D. Kasper
","We are grateful to S. Hammerschmidt
(Universität Greifswald) for pneumococcal strains and D. Kasper
",
ACS_Cent_Sci/PMC5879481.nxml,Jennifer Buz;Joseph Kirschvink,discussion;aid;measurements,,"We thank Jennifer Buz and Joseph Kirschvink for discussion
and aid with SQUID measurements.",thank
