filename,Names,Nouns,Organizations,Text,Verbs
ACS_Chem_Biol/PMC4372102.nxml,Y. Cheng,suggestions,University of North Texas,"We also thank Prof. Y. Cheng at University of North Texas for his
helpful suggestions.",thank
ACS_Chem_Biol/PMC4301072.nxml,"K. Dittenhafer-Reed;J. Lee;
J. Feldman",expression;purification;expression;purification;histone;synthesis;histone;peptide;H4;assistance;PyMOL;design,TFAM,"We would like to thank
K. Dittenhafer-Reed for the cloning, expression, and purification
of TFAM; J. Lee for the expression and purification of histone H3;
J. Feldman for the synthesis of histone H3 peptide and H4; and V.
Kuzniestsov for the assistance with PyMOL and graphical abstract design.",like;thank;clone
ACS_Chem_Biol/PMC4610303.nxml,"J. Jackson;C. Dupre;J. C. Tapia;M. C. Wang;Z. Chen;D. Peterka;R. Yuste
",assistance;brain;slices;discussions,,"We thank J. Jackson and C. Dupre for assistance with the brain
slices and J. C. Tapia, M. C. Wang, Z. Chen, D. Peterka, and R. Yuste
for helpful discussions.",thank
ACS_Chem_Biol/PMC4610303.nxml,Y. Shin,assistance;vivo;mice;experiments,,"We are grateful to Y. Shin for technical
assistance with the  in vivo  mice experiments.",
ACS_Chem_Biol/PMC4610303.nxml,"Alfred
P. Sloan Research Fellowship",support,"Columbia University;National Institutes
of Health;New Innovator Award;the U.S. Army Research
Office;the Brain Research Foundation","W.M.
acknowledges support from Columbia University, an National Institutes
of Health Director’s New Innovator Award, the U.S. Army Research
Office (W911NF-12-1-0594), the Brain Research Foundation, and an Alfred
P. Sloan Research Fellowship.",acknowledge
ACS_Chem_Biol/PMC4076014.nxml,E. Folta-Stogniew,advice;chemistry;titration;calorimetry,"
D. Hoyer","We thank
D. Hoyer and E. Folta-Stogniew for advice regarding
medicinal chemistry and isothermal titration calorimetry (respectively).
",thank
ACS_Chem_Biol/PMC4372095.nxml,Scholar Award,research;metal;S100;proteins,"the Office
;the National Institutes
of Health;the National Science Foundation;NIH;
the Kinship Foundation;the Alfred P. Sloan
Foundation;the MIT Department of Chemistry","We thank the Office
of the Director of the National Institutes
of Health (1DP2OD007045), the National Science Foundation (CHE-1352132),
the MIT Center for Environmental Health Sciences (NIH P30-ES002109),
the Kinship Foundation (Searle Scholar Award), the Alfred P. Sloan
Foundation, and the MIT Department of Chemistry for supporting our
research on metal-chelating S100 proteins.",thank;support;chelate
ACS_Chem_Biol/PMC4715766.nxml,Y. Toyoshima;C. Chao;S. van Dorp;V. Gelfand,N;assistance;syntheses;analysis;scripts;discussions,Shenzhen Shengjie Biotech Co. Ltd.,"We thank Y. Toyoshima for cDNAs encoding N-terminally
tagged
DYNC1H1 and DYNC2H1, C. Chao and Shenzhen Shengjie Biotech Co. Ltd.
for assistance with compound syntheses, S. van Dorp for imaging analysis
scripts, and V. Gelfand for helpful discussions.",thank;encode;tag;image
ACS_Chem_Biol/PMC4715766.nxml,Weill Cornell,,"NWO Rubicon Postdoctoral
Fellowship;Sloan-Kettering","Spectrum Pilot Grant to J.K.C.; an NWO Rubicon Postdoctoral
Fellowship to S.H.; Weill Cornell/Rockefeller/Sloan-Kettering",
ACS_Chem_Biol/PMC4719142.nxml,"A. Stephen;
K. Worthy;M. O’Neill;T. Anderson",expertise;assistance;surface;plasmon;resonance;experiments,"the Protein
Chemistry Laboratory;Advanced Technology Program;Frederick National
Laboratory for Cancer Research","We gratefully acknowledge Dr. A. Stephen,
K. Worthy, Dr. M. O’Neill, Dr. T. Anderson, and the Protein
Chemistry Laboratory (Advanced Technology Program, Frederick National
Laboratory for Cancer Research) for their invaluable expertise and
assistance in conducting the surface plasmon resonance experiments.
",acknowledge;conduct
ACS_Chem_Biol/PMC4719142.nxml,Q. Chen;M. A. Herrmann,A.;immunoassays;technology,Protein Simple,"We thank J.-Q. Chen and M. A. Herrmann for performing the MYC immunoassays
with Protein Simple technology.",thank;perform
ACS_Chem_Biol/PMC4719142.nxml,G. Tosato,cells,"Center for Cancer
Research","We thank G. Tosato (Center for Cancer
Research) for the CA46 cells.",thank
ACS_Chem_Biol/PMC4719142.nxml,J. Merkel,discussions;analysis,,"We also thank J. Merkel for helpful
discussions regarding microarray analysis.",thank
ACS_Chem_Biol/PMC4949583.nxml,"W. Shea Wright;Matthew Gildersleeve
",data;database,,"We would like to thank W. Shea Wright and Matthew Gildersleeve
for assisting in collecting data for the database.",like;thank;assist;collect
ACS_Chem_Biol/PMC4949583.nxml,Nancy Brandt;Ben Shorb,website,,"We also would like
to thank Nancy Brandt, Ben Shorb, and Archana Shrestha for developing
the Database of Anti-Glycan Reagents website.",thank;develop
ACS_Chem_Biol/PMC4949581.nxml,Y. Goto,assistance;dichroism;research;staff,"Osaka Analytical Center of Rigaku Corp.
","We are grateful to Y. Goto for assistance in circular dichroism
and the research staff at Osaka Analytical Center of Rigaku Corp.
",
ACS_Chem_Biol/PMC4949581.nxml,W. Offen;J. Svasti,assistance;reading;manuscript;advice;support,,"W. Offen is thanked for assistance and critical reading of the manuscript,
and J. Svasti is thanked for advice and support.",thank;thank
ACS_Chem_Biol/PMC4949584.nxml,"
G. T. Hanke;C. Crocoll",authors;discussions;input;interactions;assistance,"Queen Mary University
of London","The authors are indebted to
G. T. Hanke (Queen Mary University
of London) for valuable discussions and input regarding Fd and its
interactions, and to C. Crocoll for technical assistance.",
ACS_Chem_Biol/PMC4949584.nxml,"
L. M. Lassen",help;illustrations,DTU,"We thank
L. M. Lassen (DTU) for help with illustrations.",thank
ACS_Chem_Biol/PMC4949585.nxml,F.L. 303732/2014-8,,,"F.L. 303732/2014-8, E.H.S.S.",
ACS_Chem_Biol/PMC4720131.nxml,Glynis Scott,donation;cells;cytometry;experiments,"University of Rochester;the University of Rochester
","We thank
Dr. Glynis Scott (University of Rochester) for the
donation of HEK293 cells and the Flow Core at the University of Rochester
for assisting with flow cytometry experiments.",thank;assist
ACS_Chem_Biol/PMC4026159.nxml,Helmholtz Zentrum Berlin BESSY II,provision;synchrotron;radiation;beamline;staff;assistance,,"We
acknowledge the Helmholtz Zentrum Berlin BESSY II for provision
of synchrotron radiation at the beamline BL 14.1 and thank the scientific
staff for assistance.",acknowledge;thank
ACS_Chem_Biol/PMC4032195.nxml,E. Baumann;C. Watts,laboratory;assistance;protein;production;crystallography;experiments,,"We thank E. Baumann and C. Watts from the Schönbrunn laboratory
for assistance in protein production and crystallography experiments.
",thank
ACS_Chem_Biol/PMC4032195.nxml,Z.-Q. Fu,Z;assistance;data;collection,SER,"We also thank Z.-Q. Fu (SER-CAT) for assistance during data collection.
",thank
ACS_Chem_Biol/PMC5349656.nxml,Suzanne Eaton;Lawrence Lum,authors;gift;cells;gifts;reporter;cell;line;inhibitor,,"The authors
thank Dr. Suzanne Eaton for the kind gift of the
Shh-Light2 cells and Prof. Lawrence Lum for the kind gifts of the
Wnt reporter cell line and LGK974 inhibitor.",thank
ACS_Chem_Biol/PMC5080634.nxml,"Appie Kalaç;Jan-Willem Muller;Laura
van Smeden;Kwankwan Zhu;Hans C. de Ferrante;Esther M. van Leeuwen;Sjoerd A. S. Nooijens;Femke L. A. Vaassen;Yeshi A. de Bruin;Laura L. E. Jacobs;F. A. Wouters;Anne
M. Hessels",authors;assistance;cloning;characterization;sensors,,"The authors
thank Appie Kalaç, Jan-Willem Muller, Laura
van Smeden, Kwankwan Zhu, Hans C. de Ferrante, Esther M. van Leeuwen,
Sjoerd A. S. Nooijens, Femke L. A. Vaassen, Yeshi A. de Bruin, Elles
P. Elschot, Laura L. E. Jacobs, Simone F. A. Wouters, and Dr. Anne
M. Hessels for assistance with initial cloning and characterization
of the sensors.",thank
ACS_Chem_Biol/PMC5080634.nxml,Takeharu Nagai,authors;homology;model;structure,"Osaka
University;NLuc","The authors thank Prof. Dr. Takeharu Nagai (Osaka
University) for sharing a homology model of the NLuc structure.",thank;share
ACS_Chem_Biol/PMC4168666.nxml,"M. T. Dendle;C. Fearns
",support;manuscript,M. Saure,"We
thank M. Saure and M. T. Dendle for technical support and C. Fearns
for carefully reading and editing the manuscript.",thank;read;edit
ACS_Chem_Biol/PMC5077176.nxml,Ute Brassat,authors;discussion,Goska Broncel,"The authors
thank Ute Brassat, Goska Broncel, and Remigiusz
Serwa for helpful discussion.",thank
ACS_Chem_Biol/PMC4504433.nxml,"C. Ott;D. Buckley
",content;discussions;review;manuscript,,"the high
content assay; we thank C. Ott for helpful discussions and D. Buckley
for thoughtful review of the manuscript.",assay;thank
ACS_Chem_Biol/PMC4168794.nxml,D. V. Larsen;H. R. Hudlebusch,immunofluorescence;measurements,EpiTherapeutics,"We thank D. V. Larsen and H. R. Hudlebusch
from EpiTherapeutics ApS for performing the immunofluorescence measurements.",thank;ap;perform
ACS_Chem_Biol/PMC5404276.nxml,G. Sabat,authors;assistance;spectrometry,"University of Wisconsin—Madison Mass Spectrometry/Proteomics
Facility","The authors
thank Dr. G. Sabat, University of Wisconsin—Madison Mass Spectrometry/Proteomics
Facility, for assistance with mass spectrometry.",thank
ACS_Chem_Biol/PMC5404277.nxml,P. J. Ratcliffe;Ben Greenfield,authors;discussions;suggestions;design,"C. J. Schofield
;MFC","The authors thank C. J. Schofield
for valuable discussions, P. J. Ratcliffe for helpful suggestions on experimental design and Mr Ben Greenfield for establishing and calibrating the MFC assay.
",thank;establish;calibrate;assay
ACS_Chem_Biol/PMC5435455.nxml,Juan de la,contracts,MINECO,"A.A. and A.G. also thank MINECO for
Ramón y Cajal and Juan de la Cierva contracts, respectively.",thank
ACS_Chem_Biol/PMC5474694.nxml,"A. Coyne
",help;preparation;manuscript,,"We would like to thank A. Coyne
for help in the preparation
of this manuscript.",like;thank
ACS_Chem_Biol/PMC5565903.nxml,M. Schimpl,protein;CK2α;study,,"We kindly thank M. Schimpl for expressing
and purifying the protein CK2α used in this study.",thank;express;purify
ACS_Chem_Biol/PMC5117135.nxml,G. Chiosis;G. Sukenick;R. Wang;H. Liu;H. Fang;S. Rusli,access;instrumentation;expert;spectrometry;support,,"We thank G. Chiosis
and T. Taldone (MSKCC) for providing access
to LC-MS/MS instrumentation and G. Sukenick, R. Wang, H. Liu, H. Fang,
and S. Rusli (MSKCC) for expert mass spectrometry support.",thank;provide
ACS_Chem_Biol/PMC5117135.nxml,R01 AI068038;C. B. Thompson;I. S.,support;AI098802;AI105902;fellowship,"Financial
;the National Institutes of Health (R21/R33;Lucille Castori Center;
Inflammation;Cancer","Financial
support from the National Institutes of Health (R21/R33 AI098802 to
D.S.T. and L.G.R., R01 AI068038 to D.S.T., R21/R33 AI105902 to L.G.R.,
R01 AI076272 to E.C.P. and J.P.C., Cancer Center Support Grant P30
CA008748 to C. B. Thompson) and the Lucille Castori Center for Microbes,
Inflammation, and Cancer (postdoctoral fellowship to I. S.) is gratefully
acknowledged.",acknowledge
ACS_Chem_Biol/PMC5653948.nxml,MiSeq Sequencing,publication;support;sequencing,,"This publication
was made possible, in part, with support
from the Notre Dame Genomics and Bioinformatics Core Facility through
genomic sequencing using MiSeq Sequencing.",
ACS_Chem_Biol/PMC5653948.nxml,J. Lopez;M. Stephens,assistance,J. Sarro,"We specifically acknowledge
the assistance of J. Lopez, J. Sarro, and M. Stephens.",acknowledge
ACS_Chem_Biol/PMC5653948.nxml,M. Skalweit,strains,,"We thank M. Skalweit for providing the strains
",thank;provide
ACS_Chem_Biol/PMC5653948.nxml, E. coli;D. K. Willis; E.,coli;insights;potentiation;coli,"ATCC 31433;University
of Wisconsin","ATCC 31433 and  E. coli  MC1061 as well as technical
insights for the potentiation assay and Prof. D. K. Willis (University
of Wisconsin) for providing  E. coli  PR47.",provide
ACS_Chem_Biol/PMC5778390.nxml,J. Dahlin,input;Figure,,"We also thank J. Dahlin for
useful input to Figure 2.",thank
ACS_Chem_Biol/PMC5495094.nxml,G. Marcial;G. Lorca; L.,casei;species,,"We would like to thank G. Marcial and G. Lorca for providing  L. casei  ATCC 334 and helping growing and processing the
Lactobacillus species.",like;thank;provide;help;grow;process
ACS_Chem_Biol/PMC5495094.nxml,V. de Berardinis,A.;baylyi;strains,the  A.,"We would like to thank V. de Berardinis for
providing the  A. baylyi  ADP1 mutant strains.",like;thank;provide
ACS_Chem_Biol/PMC5824344.nxml,A.K. JSPS KAKENHI,support;work;predoctoral;fellowship;Aid;Grant;Number,"the Oxford
Glycobiology Endowment;Unither Virology LLC;Lerner–Fink
Fellowship;Medicinal Chemistry;Wellcome Trust;the Japanese Society for the Promotion of Science
","Financial support for
this work was provided by the Oxford
Glycobiology Endowment, Unither Virology LLC, a Lerner–Fink
Fellowship in Medicinal Chemistry (to J.L.K.), a Wellcome Trust predoctoral
fellowship (to A.T.C., 097300/Z/11/Z), and a Grant-in-Aid for Scientific
Research (C) from the Japanese Society for the Promotion of Science
(to A.K. JSPS KAKENHI Grant Number JP17K08362).",provide
ACS_Chem_Biol/PMC5824344.nxml,R. Dwek;K. Scott;M. Wormald,authors;discussions;spectroscopy;mass;spectrometry;assistance,NMR,"The authors thank
R. Dwek and K. Scott for useful discussions and M. Wormald and A.
Kumar for NMR spectroscopy and mass spectrometry assistance, respectively.",thank
ACS_Chem_Biol/PMC5856652.nxml,Zhihao Yu;Kristen Williams,Clowers;group;assistance;measurements;assistance;manuscript;preparation,,"We thank Zhihao Yu (Clowers group, WSU) for assistance with
HRMS measurements and Kristen Williams for her assistance in manuscript
preparation.",thank
ACS_Chem_Biol/PMC5913730.nxml,Marie Skłodowska-,No;biophysics;drug;discovery;biology;X;ray;crystallography,"BBSRC;the European Commission
;Curie Actions
Individual Fellowship;the Wellcome Trust;the Division of
Biological Chemistry and Drug Discovery","Starting Grant,
to A.C.); the BBSRC (Ph.D. Studentship, to A.A.); the European Commission
(No. H2020-MSCA-IF-2015-806323 Marie Skłodowska-Curie Actions
Individual Fellowship, to X.L.); and the Wellcome Trust (Strategic
Awards 100476/Z/12/Z for biophysics and drug discovery and 094090/Z/10/Z
for structural biology and X-ray crystallography to the Division of
Biological Chemistry and Drug Discovery at Dundee).",
ACS_Chem_Biol/PMC5913730.nxml,"S. Hughes
",support;house;X;ray;facility;advice;modeling;co;crystal;structure,,"We are grateful to P.
Fyfe for support with the in-house X-ray facility and to S. Hughes
for advice with modeling of the Fr 19  co-crystal structure.",
ACS_Chem_Biol/PMC5477779.nxml,Glynis Scott;Matt Cochran,donation;cells;cytometry;experiments,University of Rochester,"We thank Glynis Scott (University of Rochester) for the donation
of HEK293T cells and Matt Cochran along with the Flow Core at the
University of Rochester for assisting with our flow cytometry experiments.
",thank;assist
ACS_Chem_Biol/PMC5477779.nxml,Douglas Richman;HTLV-III B /H9;John C. Kappes;Xiaoyun Wu,reagesnts;B,"NIH;Reagent Program;Division of AIDS;NIAID;NIH;Tranzyme, Inc.
","The following reagesnts were obtained
through the NIH AIDS Reagent Program, Division of AIDS, NIAID, NIH:
MT-2 Cells from Douglas Richman; HTLV-III B /H9 from Robert
Gallo; TZM-bl from John C. Kappes, Xiaoyun Wu, and Tranzyme, Inc.
",follow;obtain
ACS_Chem_Biol/PMC5962930.nxml,"P. Bauknecht
;Gα-16  ;Roy J. Carver Biotechnology",authors;gift;plasmids;expression;resources;instrument;time;advice,,"The authors thank P. Bauknecht
and G. Jékely
for the generous gift of plasmids containing  apALNR  and  Gα-16  for mammalian expression and the
UIUC Roy J. Carver Biotechnology Center for providing resources, instrument
time, and helpful advice.",thank;contain;provide
ACS_Chem_Biol/PMC6006448.nxml,G. D. Montoya Scholarship,Grant;R25CA153825;fellowship,"Grant R25CA153825;National
Institute of General Medical Sciences;NIGMS","Grant R25CA153825 (predoctoral
fellowship) and the G. D. Montoya Scholarship to Y.G.; and National
Institute of General Medical Sciences (NIGMS)",
ACS_Chem_Biol/PMC6006448.nxml,A. Kornienko,authors;synthesis;beads,EHT1864;GST-PAK-PBD,"The authors
gratefully acknowledge A. Kornienko for synthesis of EHT1864 and G.
Bokoch for GST-PAK-PBD beads.",acknowledge
ACS_Chem_Biol/PMC6006448.nxml,Lin Hong,execution;thermophoresis;studies,,"We thank Dr. Lin Hong the execution
of the microscale thermophoresis studies.",thank
ACS_Chem_Biol/PMC6006448.nxml,"
B. Wilson",RBL-2H3;cells,,"RBL-2H3 cells were from
B. Wilson.",
ACS_Chem_Biol/PMC5569645.nxml,P30 GM110758-02;P20 GM104316-01A1,,P20,"(P30 GM110758-02, P20 GM104316-01A1, and P20 GM103446).",
ACS_Chem_Biol/PMC6067815.nxml,L. X. Heinz,authors;discussion,,"The authors thank L. X. Heinz for helpful discussion.
",thank
ACS_Chem_Neurosci/PMC2841011.nxml,Chirlmin Joo;Salman Syed,help;illustrations;provision;logistics;work,,We thank Chirlmin Joo for help with preparing illustrations and Salman Syed for timely provision of logistics that made this work possible.,thank;prepare
ACS_Chem_Neurosci/PMC3222219.nxml,Pippa Thomson;Elise Malavasi;Christopher Kennaway;Fumiaki Ogawa,authors;reading;manuscript;discussion;aspects;review,,"The authors wish to thank Pippa Thomson, Elise Malavasi, Ellen
Grünewald, and Christopher Kennaway for critical reading of
this manuscript and Fumiaki Ogawa and Kirsty Millar for useful discussion
on some aspects of the review.",wish;thank
ACS_Chem_Neurosci/PMC3279957.nxml,"David
R. Colman",work;memory;mentor;supporter;leader;box;thinker,,"This work is dedicated to the memory of our mentor
Dr. David
R. Colman, a great supporter, an inspiring leader, and out-of-the-box
thinker.",dedicate;inspire
ACS_Chem_Neurosci/PMC3279957.nxml,Rob Dunn;Wiam Belkaid;Ziwei Li;Sylvia Francis Zalzal,reading;manuscript;neurons;stages;project;laboratory;tissues;biomaterials;assistance;imaging,"Ajit Singh
Dhaunchak;Liliana Pedraza;DRG;Calcified;SEM","Rob Dunn, Ajit Singh
Dhaunchak, and Liliana Pedraza for critical reading of the manuscript,
Ms. Wiam Belkaid and Dr. Ziwei Li for providing DRG neurons in the
early stages of this project, and Ms. Sylvia Francis Zalzal from the
laboratory of Calcified tissues and biomaterials at Université
de Montréal for technical assistance with SEM imaging.",provide
ACS_Chem_Neurosci/PMC3279957.nxml,Patricia Yam,,,"Madeline
Pool and Patricia Yam.",
ACS_Chem_Neurosci/PMC3080107.nxml,James T. Russell;Vincent Schram,help;microscopy,,James T. Russell and Vincent Schram for their help in confocal microscopy.,
ACS_Chem_Neurosci/PMC3260741.nxml,William J. Greenlee;Mark A. Ator,suggestions;manuscript,,"William J. Greenlee and Mark A. Ator for
constructive suggestions to improve the manuscript.",improve
ACS_Chem_Neurosci/PMC3474288.nxml,Xiying Wang;Stephanie Baker,authors;neuron;preparation;work;assistance;preparation;publication;machine;shop;components;construction;system,the UIUC School of Chemical Sciences,"The authors thank Xiying Wang for the
single-neuron preparation
work, Stephanie Baker for assistance in the preparation of this publication,
and the UIUC School of Chemical Sciences machine shop for providing
various components for the construction of the CE ESI system.",thank;provide
ACS_Chem_Neurosci/PMC3986226.nxml,"Kenny J. Thiel;Lara A. Pockros;Jose Alba;Ben Engelhardt;Suzanne
M. Weber",assistance,,"We thank
Kenny J. Thiel, Lara A. Pockros, Jose Alba, Ben Engelhardt, and Suzanne
M. Weber for their technical assistance.",thank
ACS_Chem_Neurosci/PMC3656742.nxml,Paula Gabel,support,,"We would like to thank
Paula Gabel for excellent technical support.",like;thank
ACS_Chem_Neurosci/PMC4367188.nxml,Angela Steele;Qiao Han;Chris Svitek;Ryan Morrison;Frank Byers,authors;efforts;screen;laboratory;assistance;assistance;experiments,"
Alicia M. Ruggiero","The authors thank
Alicia M. Ruggiero for initial efforts to
establish the screen, Angela Steele, Qiao Han, and Chris Svitek for
general laboratory assistance, and Ryan Morrison and Frank Byers for
technical assistance associated with the pharmacokinetic experiments.",thank;establish;associate
ACS_Chem_Neurosci/PMC4404319.nxml,Danielle Goulding;Edgardo Dimayuga;N. VanTuyle;V. Shirinsky,assistance;project;advice;assistance,,"We thank
Ms. Danielle Goulding and Mr. Edgardo Dimayuga for
excellent technical assistance, and N. VanTuyle and V. Shirinsky for
project advice and assistance.",thank
ACS_Chem_Neurosci/PMC4176385.nxml,Y. Jung;C. Domigan;E. Anderson;M. Campiglio,input;stages;project;help;comments;manuscript,L.Y. Jan,"We thank Y. Jung and C. Domigan for technical
input at the
early stages of this project, E. Anderson for technical help, and
M. Campiglio and L.Y. Jan for comments on the manuscript.",thank
ACS_Chem_Neurosci/PMC4176317.nxml,Cynthia Voisine,culture;supply;cells,"
PC12-SOD1 G93A","We thank Dr. Cynthia Voisine for the culture and supply of
PC12-SOD1 G93A  cells.",thank
ACS_Chem_Neurosci/PMC4176317.nxml,Emma Doud;Paul Thomas,Proteomics,Northwestern University,"Proteomics were performed at the Proteomics
Center of Excellence at Northwestern University by Ms. Emma Doud and
Dr. Paul Thomas.",perform
ACS_Chem_Neurosci/PMC4176317.nxml,Bryan L. Roth M.D.;Jamie Driscol,Ph.D.,Chapel Hill,"The NIMH PDSP is directed by Bryan L. Roth M.D., Ph.D. at the University
of North Carolina at Chapel Hill and Project Officer Jamie Driscol
at NIMH, Bethesda MD, USA.",direct
ACS_Chem_Neurosci/PMC4176317.nxml,Kristin Jansen Labby,assistance;comments,,"We thank Dr. Kristin Jansen Labby for providing
technical assistance and helpful comments.",thank;provide
ACS_Chem_Neurosci/PMC4176384.nxml,Eric Gustafson,advice;guidance,,"Manny Esguerra and Eric Gustafson for advice and
guidance.",
ACS_Chem_Neurosci/PMC4176384.nxml,Michael Bowser;Derek Miller,optimization;advice;assistance,CE,"We also thank Michael Bowser for CE optimization advice
and Derek Miller for editorial assistance.",thank
ACS_Chem_Neurosci/PMC4324416.nxml,Li Kang;Carlo Malabanan;Ray Johnson,facility;facility;assistance,"the
Neurochemistry Core","We would
like to thank Dr. Li Kang and Carlo Malabanan at
the Mouse Metabolic Phenotyping Core facility and Ray Johnson at the
Neurochemistry Core facility for their expert technical assistance.
",thank;phenotyp
ACS_Chem_Neurosci/PMC4324416.nxml,Deng Ping Yin;Jamie Adcock,assistance,,"We would also like to thank Dr. Deng Ping Yin, Jamie Adcock, and Erin
Watt for their superb technical assistance.",like;thank
ACS_Chem_Neurosci/PMC4324418.nxml,Josh Luffman;R. Grant Muller,support,,"We thank Mr.
Josh Luffman and Mr. R. Grant Muller for their support in performing
",thank;perform
ACS_Chem_Neurosci/PMC4324418.nxml,Weimin Peng,vivo;studies;mice,,"the  in vivo  studies and Ms. Weimin Peng for breeding
of the M 4  KO mice.",breed
ACS_Chem_Neurosci/PMC4210126.nxml,"David
T. Clark",assistance;experiments;plasma,,"We also thank Mr. David
T. Clark for effective assistance with experiments in plasma.",thank
ACS_Chem_Neurosci/PMC4306477.nxml,Raquel Yustos;Scott Armstrong,assistance;cell;cultures;assistance;electrophysiology;experiments,"Department of Life Sciences;
Imperial College;Department of Surgery & Cancer;Imperial
College London","We are grateful to Raquel Yustos (Department of Life Sciences,
Imperial College) for expert technical assistance with cell cultures
and to Scott Armstrong (Department of Surgery & Cancer, Imperial
College London) for assistance in some preliminary electrophysiology
experiments.",
ACS_Chem_Neurosci/PMC4306476.nxml,Jane Wang;Summer Wu,assistance;immunolabeling;cells;conjugation;antibody,NU4,"We thank Jane Wang and Summer Wu for their assistance in the
immunolabeling of hippocampal cells and conjugation of NU4 antibody,
respectively.",thank
ACS_Chem_Neurosci/PMC5073372.nxml,Sara Jones;James Melchior,laboratory;assistance;wisdom;encouragement,,"We thank Dr. Sara Jones and
her laboratory, in particular
James Melchior, for their considerable technical assistance, wisdom,
and encouragement.",thank
ACS_Chem_Neurosci/PMC5073372.nxml,Donita Robinson,presentation;correlation;locomotion;dopamine;release;pallidum,,"We also thank Dr. Donita Robinson for suggesting
the presentation of the correlation between enhanced locomotion and
dopamine release in the ventral pallidum.",thank;suggest;enhance
ACS_Chem_Neurosci/PMC4372063.nxml,Mari Prieto;Glen Gregory,authors;instrumentation;advice,"
Thermo Fisher Corporation","The authors acknowledge Dr. Mari Prieto,
Glen Gregory and
Thermo Fisher Corporation for technical and instrumentation advice.",acknowledge
ACS_Chem_Neurosci/PMC4372074.nxml,Matthew Buendia;Mary Akel;Aliya Frederick;Emily Ross;Kelli Money,support;manuscript;advice;conversations,,"We thank Matthew Buendia and Mary Akel for excellent technical support
and Dr. Aliya Frederick, Emily Ross, and Kelli Money for reviewing
the manuscript and helpful advice and conversations.",thank;review
ACS_Chem_Neurosci/PMC4372064.nxml,Tracy Chen;Jeffrey Jiang;John Kehne,studies;contract;site,the University of Utah,"Tracy Chen, Jeffrey Jiang, and John Kehne for
kindly conducting the pharmacological studies through the ASP’s
contract site at the University of Utah with Drs.",conduct
ACS_Chem_Neurosci/PMC4372064.nxml,H. S. White;K. Wilcox,,,"H. S. White, H.
Wolfe, and K. Wilcox.",
ACS_Chem_Neurosci/PMC4653762.nxml,Ulrik Gether,discussions,Professors Aurelio Galli,"Illuminating discussions with Professors Aurelio Galli, Jonathan
Javitch, and Ulrik Gether are gratefully acknowledged.",illuminate;acknowledge
ACS_Chem_Neurosci/PMC4653763.nxml,P. O. Couraud;Institute Cochin,hCMEC;cell;line,,"We thank Dr. P. O. Couraud, Institute Cochin, Paris,
France
for providing the hCMEC/D3 cell line.",thank;provide
ACS_Chem_Neurosci/PMC4653763.nxml,Elizabeth A. Eckman,cell;line,"
Biomedical Research Institute;NJ;APP;SH-","We thank Dr. Elizabeth A. Eckman,
Biomedical Research Institute of New Jersey, NJ, for providing the
APP transfected SH-SY5Y cell line.",thank;provide;transfect
