filenamne,Text,keywords
3D_Print_Med/PMC5954789.nxml,"The authors wish to acknowledge Diya Ma, Matthew-Lun Wong, Ka-Long Ko, Ka-Hei Ko and Jin-Peng Lee for their important contributions to the software development.",software
3D_Print_Med/PMC5954792.nxml,The authors would like to thank Michel Vong of the University of Edinburgh for his help and support in the operation of the 3D printing and video recording/editing.,printing
3D_Print_Med/PMC5954794.nxml,"The authors would like to thank Dr. Dinghau Huang of Ming Chi University of Technology and Prof. Pi-Hsia Liu of the Chang Gung University of Science and Technology for their arrangement for voluntary participants in the orthosis design exercise, and great advice concerning the interviews.",design
3D_Print_Med/PMC5954797.nxml,"SL: Study design, Data Acquisition, Data Analysis, Drafting of manuscript, Critical revision of the manuscript.",analysis;data;design
3D_Print_Med/PMC6036666.nxml,"The authors would like to thank Thomas Vrieze for assistance in phantom data acquisition, and Kris Nunez for assistance in manuscript preparation.",data
3D_Print_Med/PMC6036666.nxml,"Study design, Data Acquisition, Data Analysis, Drafting of manuscript, Critical revision of the manuscript.",analysis;data;design
3D_Print_Med/PMC6036666.nxml,"Study design, Data Acquisition, Data Analysis, Critical revision of the manuscript.",analysis;data;design
3D_Print_Med/PMC6036666.nxml,"SL: Study design, Data Acquisition, Data Analysis, Drafting of manuscript, Critical revision of the manuscript.",analysis;data;design
3D_Print_Med/PMC6036764.nxml,These include Dr. Bill Mohler from the University of Connecticut at Farmington for the  C. elegans  embryo dataset and Dr. Sara Crittenden at the University of Wisconsin at Madison for the dataset of the distal tip cell.,cell
3D_Print_Med/PMC6036601.nxml,"The authors wish to acknowledge Teng Zhang, Matthew-Lun Wong, Ka-Long Ko, Ka-Hei Ko, Lily Ma, Jin-Peng Lee for their import contributions to the software development, and Nicholas K.W. Kwok, Winnie Chiu-Wing Chu, Jack Chun-Yiu Cheng for their great advices and helpful discussions.",software
3D_Print_Med/PMC6036610.nxml,The authors would like to thank Drs Bohdan Pomahac and Amir Imanzadeh for their invaluable contribution in data collection and in preparation of the manuscript.,data
3_Biotech/PMC3339618.nxml,"The authors would like to express their gratitude to Professor Roy H. Doi from the University of California (USA) for the kind donation of the  C. cellulovorans  plasmid constructs, and thanks to Dr Volker Fischer from Agro-yields, South Africa, for kindly providing the sugar beet.",plasmid
3_Biotech/PMC3339622.nxml,"We thank Dr Deborah Stenzel, QUT, for assistance in electron microscopy.",microscopy
3_Biotech/PMC3482444.nxml,"The authors would like to thank Prof. Jayesh Bellare, Department of Chemical Engineering, IIT Bombay for providing facilities for BET surface area measurement and Centre for Research in Nanotechnology and Science—Sophisticated Analytical Instrumental Centre (CRNTS-SAIF) at IIT Bombay for FTIR analysis of algal samples.",analysis;chemical
3_Biotech/PMC3339602.nxml,"The Authors are grateful to Dr. G. S. Avadhani, Principal Research Scientist, IISc, India, for taking TEM images.",tem
3_Biotech/PMC3433876.nxml,"We thank Prof. K. Veluthambi, MKU, Madurai, India for  Agrobacterium tumefaciens  strain and Center for
Application of Molecular Biology to International Agriculture (CAMBIA), Australia
for pCAMBIA2301.",strain
3_Biotech/PMC3597133.nxml,"The authors want to express their thanks to Prof. A. Subrahmanyam, Meerut Institute of Engineering and Technology, Meerut, India for providing the strain for this study.",strain
3_Biotech/PMC3723860.nxml,"The authors are thankful to Dr. R. Malhotra, Scientist (Statistics), National Dairy Research Institute (NDRI), Karnal for his help in statistical analysis of the data.",analysis;data;statistical;statistics
3_Biotech/PMC3824784.nxml,"Authors thank Helen Chan laboratory assistant and Pedro J Martinez Garcia postdoc at UC Davis, for their collaboration in lab work and data analysis.",analysis;data
3_Biotech/PMC3646113.nxml,"Shripad N. Surwase is thankful to Dr. James S. Hyde and Dr. Christopher C. Felix, Department of Biophysics and Center for Imaging Research Medical College of Wisconsin, Milwaukee, WI, USA, for providing EPR analysis facility.",analysis;imaging
3_Biotech/PMC3964253.nxml,"We wish to thank Dr. B. Meyer, Mr. M. Rajab for helping in DNA sequencing, M. Al-Buhairi, N. Venturina for technical assistance, and Dr. M. Shoukri for statistical advice.",dna;sequencing;statistical
3_Biotech/PMC3964251.nxml,"The authors gratefully acknowledge School of Chemical Sciences, Mahatma Gandhi University, Kottayam, Kerala, India, for the help and support for the analysis of samples and also DBT-RGYI (Department of Biotechnology-Rapid Grant Young Investigator) Programme for the instrumentation facility.",analysis;chemical
3_Biotech/PMC4235891.nxml,"The authors would like to thank Dr. U Basu (Department of Molecular Biology and Biotechnology, University of Kalyani) and Dr. P Roy (SINP) for providing nanodrop and TEM facilities, respectively.",tem
3_Biotech/PMC4624133.nxml,"The Web interface for Signal Scan was kindly provided by Ms. Meena Sakharkar at Bioinformatics Centre, NUS, Singapore.",scan
3_Biotech/PMC4434417.nxml,"We express our heartfelt thanks to Mrs. K. Prashanthi, Jain University, Bangalore, for her assistance in HPLC analysis.",analysis;hplc
3_Biotech/PMC4362734.nxml,The authors wish to thank Daniel van de Pas for SEW preparation and Katrina Martin for analysis of the substrate using ion chromatography.,analysis;chromatography
3_Biotech/PMC4909027.nxml,"The authors would like to thank Plant Tissue Culture Laboratory of Dikili Ciftlik in vitro Fidan A. S, Dikili-Izmir, Turkey, for kindly providing us endophytes comprising rootstock samples.",culture;tissue
3_Biotech/PMC4522729.nxml,"We also thank Yuehan Lu, University of Alabama, Tuscaloosa, AL, for providing the results of the GC–MS analysis of the sediment samples; John Delton Hanson of Research and Testing Laboratory, TX for assisting us with the bTEFAP of the samples; Katherine V. Hughes and Matthew Pace of UAB CAS IT for computer support.",analysis
3_Biotech/PMC4569639.nxml,"We thank Dr. M. Lakshman, Associate Professor, Ruska Lab, College of Veterinary Science, Rajendranagar, Hyderabad, for SEM analysis and all the staff of the biocontrol unit of ICRISAT including M/s PVS.",analysis;sem
3_Biotech/PMC4569624.nxml,"Authors thank the management of Jain University, India for providing necessary facilities to carry out the work and Dr. Savithri H.S., Department of Biochemistry, Indian Institute of Science, Bangalore, India for providing the HPLC facility.",hplc
3_Biotech/PMC4940232.nxml,The help provided by Dr. Tiratha Raj Singh in performing statistical analysis is also acknowledged.,analysis;statistical
3_Biotech/PMC4752955.nxml,We would like to thank Saeed Vakilian for some statistical analysis.,analysis;statistical
3_Biotech/PMC4697910.nxml,"Vo Van Giau collected the samples, performed the experiments, analyzed and interpreted the data and wrote the manuscript.",data
3_Biotech/PMC4729760.nxml,"Authors wish to thank Dr. P.H. Tank, Dr. M. G. Maradia, Dr. P. I. Vaghela, Dr. B. M. Shah and Dr. U. G. Koringa for kindly providing horn cancer and normal tissue.",tissue
3_Biotech/PMC4909029.nxml,We would like to thank Analytical Sciences department at Praj Matrix for the analysis of samples and Mr. Siddharth Pal for providing hemicellulosic hydrolysate of corn cob.,analysis
3_Biotech/PMC4701705.nxml,"We thank Dr. K. K. Kumar (Department of Plant Biotechnology, TNAU) for his help in Southern analysis.",analysis
3_Biotech/PMC4752952.nxml,Authors thank as well Thiago de Jesus Costa (Universidade de Brasília) and João Victor Mendanha Costa (Universidade Católica de Brasília) for the technical support and Sônia Báo (Universidade de Brasília) who provided facilities at the Laboratory of Electron Microscopy.,microscopy
3_Biotech/PMC4912962.nxml,"We thank Prof. T. Satyanarayana, Department of Microbiology, South Campus, Delhi University, Delhi, for extending facilities for enzyme purification.",enzyme
3_Biotech/PMC4909018.nxml,"We would like to thank Dr. Ghada A. Abu El-Heba, Researcher, Department of Nucleic Acid and Protein Structure, Agricultural Genetic Engineering Research Institute (AGERI), ARC, Giza, Egypt, for helping us in gene sequencing and alignment.",protein;sequencing
3_Biotech/PMC5005230.nxml,"We thank Dr. Wolfgang Zachariae, Max Planck Institute of Molecular Cell Biology and Genetics, Germany for providing genomic-tagged  CDC5 - TAP  yeast strains.",cell
3_Biotech/PMC5002272.nxml,"We thank Dr. Sandeep Kale for providing HPLC facility at DBT-ICT Centre for Energy Biosciences, Institute of Chemical Technology, Mumbai, India.",chemical;hplc
3_Biotech/PMC5112185.nxml,The authors wish to thank Picklu Mandal for all his assistance during sample collection.,sample
3_Biotech/PMC5042906.nxml,"Vo Van Giau collected the samples, performed the experiments, analyzed and interpreted the data and wrote the manuscript.",data
3_Biotech/PMC5052223.nxml,"The authors are highly grateful to Dr. A. Spena, Max-Planck-Institute fur Zuchtungsforschung, 5000 Koin 30, FRG for providing the vectors.",vectors
3_Biotech/PMC4569622.nxml,"The first author thankfully acknowledge for the research assistantship provided by TEQIP-II (Technical Education Quality Improvement Programme) and Mr. Smritiranjan Majhi from Central Instrument Facility Laboratory, Bose Institute, Kolkata (West Bengal), India for the technical support in GC–MS analysis.",analysis
3_Biotech/PMC5116299.nxml,Sequencing  M. burkeana  RNA was performed at the Biotechnology Platform of the Agricultural Research Council of South Africa.,rna;sequencing
3_Biotech/PMC5010538.nxml,"Technical assistance for HPLC analysis provided by Dr. R.N. Ram, Professor and Head, Department of Fishery Biology, College of Fisheries is gratefully acknowledged.",analysis;hplc
3_Biotech/PMC4752949.nxml,"They also wish to acknowledge Dr. K. Kartikeyan, Gujarat Institute of Desert Ecology, for help in physicochemical analysis of soil samples.",analysis
3_Biotech/PMC5234526.nxml,"We extend our sincere thanks to Dr. Thenmalarchelvi Rathinavelan, Department of Biotechnology, and Dr. Debraj Bhattacharya and Dr. K. B. V. N Phanindra, Department of Civil Engineering, IIT Hyderabad for allowing us to do spectrophotometric analysis.",analysis
3_Biotech/PMC5009053.nxml,"Director and Mr. Dineep D., Scientific Assistant of the Inter-University Instrumentation Centre, Mahatma Gandhi University, Kottayam for the help and support for the LC–MS/MS analysis.",analysis
3_Biotech/PMC5403768.nxml,Authors greatfully acknowledge Mr. Rupak Kishor for his help in EDX analysis.,analysis
3_Biotech/PMC5388660.nxml,We are also thankful to Dr. P. N. Saxena for his help in SEM studies.,sem
3_Biotech/PMC5391370.nxml,"The authors also gratefully acknowledge R. K. Roy, Nutek Inc., USA, for providing the Qualitek-4 software.",software
3_Biotech/PMC5766454.nxml,We would like to thank Andrzej Kuźma for special care given to the animals.,animals
3_Biotech/PMC5866818.nxml,"The authors thank the following organizations for providing facilities including Energy Research Center (ERC), School of Renewable Energy, Program in Biotechnology (Faculty of Science) and Swine farm (Animal Science and technology), Maejo University, Chiang Mai, Thailand.",animal
AAPS_J/PMC3326161.nxml,"We thank Willard Foss, Viktor Peykov, Tapas De and Jon Cordia at Celgene for providing data on attempted copies of nab-paclitaxel.",data
AAPS_J/PMC3282010.nxml,"The authors acknowledge Dr. Urs Simmen (Schötzau & Simmen, Statistische Beratungen, Switzerland) for his assistance in statistical work.",statistical
AAPS_J/PMC3281999.nxml,"We thank Robin Hartman, Maaike Labots, and Nathalie Doorenweerd for help with the animal surgery and microdialysis experiments.",animal
AAPS_J/PMC2976986.nxml,"The authors would like to thank P. Pfaffenbach (Solvay Infra Bad Hönningen GmbH, Hannover, Germany) for his assistance on XRPD analysis.",analysis
AAPS_J/PMC3787226.nxml,The authors acknowledge Dr. Vishwas Rai for the help and assistance provided with the cell culture work.,cell;culture
AAPS_J/PMC4540732.nxml,"Robert Connor and Ge Wei for assistance with protein purifications, and Dr. Rose Sekulovich for assistance with extended characterization of purified antibodies.",protein
AAPS_J/PMC4476998.nxml,"Many thanks to Mark Maasland (Fraunhofer) for the morphometric analysis and program development, Yulia Mordashova for the excellent statistical support, and Jacob Lee for his outstanding mass spectrometric serum hepcidin measurements.",analysis;serum;statistical
AAPS_J/PMC6044282.nxml,"Mary Estes (Baylor College of Medicine, Houston, TX) for her invaluable guidance and support of our research, including sharing of study protocols to culture and characterize canine organoids, as well as Jordan Gongora (Biomedical Sciences, Iowa State University, IA) for her graphic design support.",culture;design
AAPS_PharmSciTech/PMC2850496.nxml,"Acknowledgments also to Tom-Ivar Eilertsen, University of Tromsø for doing the SEM micrographs, Merete Linchausen Skar, University of Tromsø, for measurements of bulk and tapped volumes, Rahul Vasantrao Haware and Skjalg Nyheim Solum, University of Tromsø for valuable discussions.",sem
AAPS_PharmSciTech/PMC2974134.nxml,"We thank Dr. Henry Brem at the Johns Hopkins University, for providing frozen brain tissues, Dr. Kacy Cullen and Dr. Michelle LaPlaca at the Georgia Institute of Technology for providing cortical neurons, and Dr. Heather Bara and Dr. Thanassios Sambanis at the Georgia Institute of Technology for providing adeno-associated virus.",virus
AAPS_PharmSciTech/PMC2974134.nxml,Dr. Sumit Paliwal and Dr. Samir Mitragotri carried out the  in vitro  tissue permeability studies.,tissue
AAPS_PharmSciTech/PMC2974134.nxml,"Dr. Krys Bankiewicz and John Bringas carried out the  in vivo  non-human primate study, and Dr. Gill Heart carried out its quantitative analysis.",analysis
AAPS_PharmSciTech/PMC3969488.nxml,"The authors would like to thank Yoshiko Fukuoka and Kazuyoshi Ogasawara for tablet formulation, Nobuo Aone and Akihito Kiguchiya for data acquisition support, and Toru Nakai and Fusashi Ishikawa for discussions regarding formulation analysis.",analysis;data
AAPS_PharmSciTech/PMC4179662.nxml,"The authors acknowledge the facilities, and the scientific and technical assistance of the Australian Microscopy & Microanalysis Research Facility at the Electron Microscope Unit, The University of New South Wales, and in particular, Judy Loo Ching Yee and Delfine Cheng who provided assistance with the cryo-TEM analysis of the samples.",analysis;microscopy
IBRO_Rep/PMC6084867.nxml,"First, we would like to acknowledge and thank Matt Ferola and Carlos Maya for their diligent and compassionate care of the animals involved in these studies.",animals
IBRO_Rep/PMC6084822.nxml,I am also grateful to Dr. Erika Scholl for her assistance in measuring rat serum osmolarity and to Dr. Noel Carlson for his insightful comments on the manuscript.,rat;serum
IBRO_Rep/PMC6084913.nxml,"The experimental data have also been accumulated by Mrs. Shotaro Suzuki, Yudai Hirano, and Kota Kume.",data
IBRO_Rep/PMC6084925.nxml,"The authors would like to thank the Flinders Biomedical Engineering Department, Mark McEwen and Noel Kitto for technical support, the Animal and Microscopy Facilities of Flinders University, Dr. Timothy Chataway, and the Alzheimer's and Parkinson diseases' lab especially Fariba Chegini for their enthusiastic discussions and support.",animal;microscopy
IBRO_Rep/PMC6084925.nxml,We also acknowledge Ms Robyn Flook and the South Australian Brain Bank in supplying all the brain tissue used in this study.,tissue
IBRO_Rep/PMC6084826.nxml,The authors would like to acknowledge the excellent technical assistance of Natacha Bazin and Tevrasamy Marday for the perfect care provided to rats throughout the studies.,rats
IBRO_Rep/PMC5507617.nxml,"The authors would like to thank Dr. Marta Miquel (Universitat Jaume I, Spain) for helpful discussions and the entire Sorg lab for assisting with the analysis.",analysis
IBRO_Rep/PMC6095098.nxml,The authors would like to thank Amanda Penko and A. Elizabeth Jansen for their roles in data collection.,data
IBRO_Rep/PMC6084862.nxml,"The authors are grateful to Professors Michael A. Silverman for BDNF plasmid, Debora R. Fior-Chadi and Edilamar Menezes for helping with physical exercise protocol.",plasmid
IBRO_Rep/PMC6111069.nxml,"Ms. Emmaline Bendell, Ms. Bingyu Zou and Dr. Ying Sun performed the animal breeding and histology; Dr. Carlos Blanco-Centurion performed the microscopy and cell counting.",animal;cell;microscopy
IDCases/PMC4672608.nxml,"We would like to thank Kathie Grant and Corinne Amar in the Gastrointestinal Bacteria Reference Unit, and Karen Broughton and Mary Slack in the Respiratory and Systemic Infection Laboratory for their comments on these cases and help interpreting laboratory data.",data
IDCases/PMC4735079.nxml,"The State Hygienic Laboratory of Iowa, 2490 Crosspark Rd, Coralville, IA 52241 performed initial culture and identification of the mold.",culture
IDCases/PMC4735459.nxml,We thank Dr. Nabeela Khan for contributing to the data analysis at Griffin Hospital.,analysis;data
IDCases/PMC4802676.nxml,"The author wishes to thank Dr. Caudia Vannini (Department of Biology, Pisa) for her contribution to the sequencing of the isolate.",sequencing
IDCases/PMC4840421.nxml,We acknowledge Ms. Jessica Friley for her help with animal studies and Ms. Haley Pipkins for technical support.,animal
IDCases/PMC4925901.nxml,"We thank Stéphane Lastère from the “Centre Hospitalier Territorial, Pirae, Tahiti, French Polynesia” for leptospirosis PCR diagnosis.",pcr
IDCases/PMC5007293.nxml,"We acknowledge Mr. Henk Brunings for performing all RT-PCR, and Dr. Mirdad Kazanji, Dr. Dominique Roussett, and Antoine Enfissi of Institute Louis Pasteur in Cayenne, French Guyana, for sequencing, phylogenetic analysis and fruitful discussion, and the Arboviral Diseases Branch of the Center for Disease Control and Prevention in Fort Collins, Colorado, USA, for providing Zika virus RNA.",analysis;rna;sequencing;virus
IDCases/PMC5423323.nxml,"We wish to thank Tatsuya Nakamura Ph.D., from the Department of Clinical Laboratory in Kobe University Hospital, for performing polymerase chain reaction and DNA sequence analyses of our CA-MRSA strains.",analyses;dna
IDCases/PMC5675711.nxml,"We also thank employees of the Clinical Laboratory of the Academic Hospital Paramaribo for their efforts, in particular Mr. Henk Brunings for performing ZIKV PCR.",pcr
IDCases/PMC6010936.nxml,"Also, special thanks to Phang Nga hospital, Thai Muaeng Chaipat hospital, and Center of Vector Bone Disease Control 11.1 Phang Nga.",vector
IEEE_J_Transl_Eng_Health_Med/PMC4839306.nxml,The authors would like to thank Dr. Sujata K. Bhatia for her support and Health Partners International for access to the software used to carry out inventory collection and analysis.,analysis;software
IEEE_J_Transl_Eng_Health_Med/PMC4848049.nxml,The authors would like to thank Megan Schmidt for assistance with data collection and Monica Mahre for help with manuscript preparation.,data
IEEE_J_Transl_Eng_Health_Med/PMC4848101.nxml,The authors would like to thank Bev de Jong for assistance in obtaining the ECG recordings and the analysis of Ewing battery results.,analysis
IEEE_J_Transl_Eng_Health_Med/PMC4848077.nxml,Authors are grateful to Dr. A. K. Susheela for providing the valuable suggestion and guidance during lab analysis.,analysis
IEEE_J_Transl_Eng_Health_Med/PMC4848075.nxml,"The authors would also like to thank Jennifer Hadway, Laura Morrison, and Lise Desjardins for their help in conducting the animal experiments.",animal
IEEE_J_Transl_Eng_Health_Med/PMC4848075.nxml,"{}$t$
\end{document} Time SUBSCRIPTS \documentclass[12pt]{minimal}
\usepackage{amsmath}
\usepackage{wasysym} 
\usepackage{amsfonts} 
\usepackage{amssymb} 
\usepackage{amsbsy}
\usepackage{upgreek}
\usepackage{mathrsfs}
\setlength{\oddsidemargin}{-69pt}
\begin{document}
}{}$A$
\end{document} Air condition (i.e., O 2 -Air, O 2 -Xe) \documentclass[12pt]{minimal}
\usepackage{amsmath}
\usepackage{wasysym} 
\usepackage{amsfonts} 
\usepackage{amssymb} 
\usepackage{amsbsy}
\usepackage{upgreek}
\usepackage{mathrsfs}
\setlength{\oddsidemargin}{-69pt}
\begin{document}
}{}$b$
\end{document} Blood condition in Inhalation \documentclass[12pt]{minimal}
\usepackage{amsmath}
\usepackage{wasysym} 
\usepackage{amsfonts} 
\usepackage{amssymb} 
\usepackage{amsbsy}
\usepackage{upgreek}
\usepackage{mathrsfs}
\setlength{\oddsidemargin}{-69pt}
\begin{document}
}{}$m$
\end{document} Mucous tissue \documentclass[12pt]{minimal}
\usepackage{amsmath}
\usepackage{wasysym} 
\usepackage{amsfonts} 
\usepackage{amssymb} 
\usepackage{amsbsy}
\usepackage{upgreek}
\usepackage{mathrsfs}
\setlength{\oddsidemargin}{-69pt}
\begin{document}
}{}$B$
\end{document} Brain Xe Xenon",tissue
IEEE_J_Transl_Eng_Health_Med/PMC4848063.nxml,The authors thank Sandy Yu for her help in video recording and data collection.,data
IEEE_J_Transl_Eng_Health_Med/PMC4848045.nxml,"The authors would like to express deep appreciation and special thanks to Dr. Roderic Pettigrew, Director of the National Institute of Biomedical Imaging and Bioengineering for his inspirational thoughts and plenary talk at the conference.",imaging
IEEE_J_Transl_Eng_Health_Med/PMC4852539.nxml,"The authors would also like to acknowledge W. Q. Tan, S. J. Lim, J. J. Lim and T. M. Aung for their assistance in the data collection.",data
IEEE_J_Transl_Eng_Health_Med/PMC4993133.nxml,"The authors acknowledge very helpful guidance and suggestions in selection of the colo-rectal cancer cell lines and the choice of drugs from Dr. J. Jousha Smith, a Surgical Oncologist at Memorial Sloan Kettering Cancer Center, New York, NY.",cell
IEEE_J_Transl_Eng_Health_Med/PMC4993148.nxml,"J. Austin also thanks Professor Todd Leen, who provided guidance and support in computing model statistics and generating descriptive figures.",statistics
IEEE_J_Transl_Eng_Health_Med/PMC5052028.nxml,"Finally, they thank Mr. Teruaki Nochino, Mr. Tianyi Wang, Mr. Takafumi Ohno, Mr. Hideto Imai from Osaka University for their analysis of the measured data and their generous comments on the analysis results.",analysis;data
IEEE_J_Transl_Eng_Health_Med/PMC5127706.nxml,"The authors would like to acknowledge our participants, and graduate assistants Jenna Cost and Rhea Proctor for assistance in data collection.",data
IEEE_J_Transl_Eng_Health_Med/PMC5396943.nxml,"A complete meeting summary was prepared by Susan Spence, PhD, Silvia Paddock, PhD, Payal Shah Martin, MPH, and Rose Maria Li, MBA, PhD, Rose Li and Associates, Inc., under contract to the National Institute of Biomedical Imaging and Bioengineering (NIBIB Contract Number HHSN268201600011A).",imaging
IEEE_J_Transl_Eng_Health_Med/PMC5411259.nxml,The authors would like to thank Dr. Albert Sinusas of Yale University for the canine experiments and imaging data.,data;imaging
IEEE_J_Transl_Eng_Health_Med/PMC5411244.nxml,"The authors thank the BCM Core for Advanced Magnetic Resonance Imaging (CAMRI) for their MRI support (especially Lacey Berry, Krista Runge, and Michael Beauchamp) and the Center for Comparative Medicine for veterinary assistance (especially Dalis Collins, Paul Johnson, and Jenni Adams).",imaging
IEEE_J_Transl_Eng_Health_Med/PMC5630006.nxml,"The authors would like to thank Yuriko Taniguchi, Osaka University, who helped us with the MMSE data collection, and Yuko Kawaguchi who recorded the speech data of our paraphrase component.",data
IEEE_J_Transl_Eng_Health_Med/PMC5881457.nxml,They would also like to thank Anita Stockselius for helping with the ACMC tests and analyses.,analyses
IEEE_J_Transl_Eng_Health_Med/PMC5951609.nxml,"The authors would like to thank Edoardo Bonizzoni for his help in regard to the technical aspects of the data collections, A. O’Brien and S. Rajan for their help recruiting subjects and carrying out the data collections, and all the study participants (stroke survivors, control subjects, and occupational therapists) who volunteered their time to provide us with valuable feedback about the proposed system.",data
IEEE_J_Transl_Eng_Health_Med/PMC6054514.nxml,The authors would like to thank Prof. A. Slocum and J. Yang for their valuable guidance and suggestions with device design.,design
IEEE_Trans_Neural_Syst_Rehabil_Eng/PMC5623133.nxml,We gratefully acknowledge Dr. Shawn O'Connor for contributing software for and instruction on the virtual reality system used in this study.,software
ILAR_J/PMC5886341.nxml,"Current MGI members include co-principal investigators Judith A. Blake, Carol J. Bult, James A. Kadin, Martin Ringwald, Joel E. Richardson, Cynthia L. Smith; informatics analysts and curators: Anna Anagnostopoulos, Dale A. Begley, Susan M. Bello, Richard M. Baldarelli, Karen Christie, Harold J. Drabkin, Jacqueline H. Finger, Paul Hale, Terry F. Hayamizu, David P. Hill, Michelle N. Knowlton, Debra M. Krupke, Monica McAndrews, Ingeborg J. McCright, Li Ni, Hiroaki Onda, Jill M. Recla, Deborah J. Reed, Beverly Richards-Smith, Dmitry Sitnikov, Constance M. Smith, Monika Tomczuk, Laurens Wilming, Jinxia Xu, Yunxia Zhu; software developers: Jonathan S. Beal, Olin Blodgett, Jeffrey W. Campbell, Lori E. Corbani, Mary E. Dolan, Peter Frost, Sharon C. Giannatto, Lucie Hutchins, Jill R. Lewis, David B. Miers, Howie Motenko, Steven B. Neuhauser, Kevin R. Stone; user support staff: MeiYee Law, David R. Shaw; and administrative support staff: Nancy E. Butler, Janice E. Ormsby.",software
