filenamne,Text,keywords
ISME_J/PMC4303643.nxml,"We thank Colin Roberts and Pete Scarlett (CEH) for the river sampling, and Emma Gozzard, Linda Armstrong, Sarah Harman and Heather Wickham of the CEH Nutrient Laboratories for carrying out the chemical analysis.",analysis;chemical
ISME_J/PMC4737935.nxml,"We thank A Culley and C Schvarcz for assistance in collecting virus samples; A Alpert and E Woznica for their collection and processing of bacterial production samples; K Coleman, M Garzio, T Miles and C Funkey for assistance with sample collection; the employees of Raytheon Polar Services Company for their support; A Gregory and B Poulos for assistance in conducting linker amplification; B Poulos and V Rich for assistance with bacterial DNA extraction; A Westveld for assistance with social network analysis; and members of the Tucson Marine Phage Lab, E Allers and V Rich for their support and critical review of this research.",dna;sample;virus
ISME_J/PMC3930316.nxml,"We thank Ying Sun for the help on picture drawing and editing, and also thank Yanping Zheng for the help on sample collection.",sample
ISME_J/PMC4409162.nxml,We thank Salome Schneider (Swedish University of Agricultural Sciences) for helping with soil sampling and DNA extraction as well as Stephanie Pfister (Agroscope INH) for technical assistance with PCR amplicon generation.,dna;pcr
ISME_J/PMC4409153.nxml,"We thank Profs Renkou Xu, Guoliang Ji, Jinling Yang, Biao Huang and Jiuyu Li at the Institute of Soil Science for suggestions on the soil physiochemical characteristics, Mr Yu Shi for statistical analysis, Ms Rong Huang for pyrosequencing of  amoA  genes and our lab colleagues for helpful discussions.",analysis;statistical
ISME_J/PMC4409164.nxml,Final thanks extend to Dr Margaret Hughes and Professor Andrew Cossins at the Centre for Genomic Research (Liverpool University) for additional 454 Roche sequencing support.,sequencing
Obes_Facts/PMC5644672.nxml,"We sincerely thank our statistician Lars Ängquist, PhD, for his contribution to the additional analyses.",analyses
Obes_Facts/PMC5644847.nxml,We thank E. Molz for statistical analysis.,analysis;statistical
Obes_Facts/PMC5644836.nxml,We thank Eugenia Flores Alfaro and Iris Paola Guzmán Guzmán for statistical analysis.,analysis;statistical
Obes_Facts/PMC5644670.nxml,"We thank Thor Helge Bergan for providing results of the early Norway studies, Elena Danilenko for deactivating ion generators, Ekaterina Tolstykh for randomization and instructing study participants on how to use the intervention devices, Evgeniy Verevkin for processing meteorological data, Anna Wirz-Justice for English editing and comments on the manuscript, Eryl Price of Lumie for English editing of the final version of the manuscript.",data
Obes_Facts/PMC5644820.nxml,"The authors are grateful to Selma Cvijetić, MD, PhD, for her expert help with statistical analysis and suggestions during the preparation of this manuscript.",analysis;statistical
Obes_Facts/PMC5644837.nxml,"We thank Bogdan Dragulescu from Politehnica University of Timișoara for rendering the vector map of Romania and designing a script (Phyton programming language) that uses the revised IOTF cut-offs to calculate prevalence of Thinness, Overweight and Obesity in Children.",vector
Obes_Facts/PMC5644837.nxml,"We also acknowledge Silvia Mandasescu (Roman Municipal Hospital), Lecturer Cornel Vălean and Prof. Mircea Nanulescu (Clinical Emergency Hospital for Children Cluj) for their involvement in data collection.",data
Obes_Facts/PMC5644822.nxml,We would like to thank Mr Marcus Ritter for his help with the analysis of the MRI images.,analysis
Obes_Facts/PMC5644674.nxml,We are grateful for the contribution of schools and children who participated in the study and the statistical advice from David Boniface.,statistical
Obes_Facts/PMC5644677.nxml,We would like to thank L.M. Dijksman (MSc) for her statistical advice.,statistical
Obes_Facts/PMC4343283.nxml,"Special thanks to Ms. Emily Mire and Ms. Connie Murla for data management, and to Dr. Jennifer Rood and the staff of the Clinical Chemistry Laboratory as well as the many clinical scientists and staff of the PBRC who have contributed data to the development of the PCLS.",data
Obes_Facts/PMC5644824.nxml,"We also thank Mrs. Gerlinde Trischler (Department of 2 Internal Medicine II - Cardiology, Medical Clinic Ulm) for the measurement of serum concentrations of cardiometabolic risk factors.",serum
Obes_Facts/PMC5644797.nxml,"J. Martin-Fernandez: substantial contribution to conception and design, acquisition of data, analysis and interpretation of data and drafting the article, revising it critically for important intellectual content.",analysis;data;design
Obes_Facts/PMC5644848.nxml,"We thank Koji Oba for statistical analysis, and the participating students for their co-operation.",analysis;statistical
Obes_Facts/PMC5644905.nxml,"The authors wish to thank Andreas Stettbacher, Chief Medical Surgeon of the Swiss Armed Forces (for providing the individual conscription data 1992-2014); Franz Frey and Tiziano Angelelli, Logistikbasis der Armee - Sanität (for their support); Michael Hotz and Anja Wiederkehr for collecting parts of the historical data; Ulrich Woitek, Tobias Schoch, Radoslaw Panczak, Marcel Zwahlen, Jonathan Wells, Barry Bogin, Maciej Henneberg, Randolph Nesse, Bernard Harris, John Komlos, and Michael Hermanussen (for helpful comments).",data
Obes_Facts/PMC5644900.nxml,"We also thank Junji Kishimoto, Ph.D., for his contribution to the statistical analysis, and Ayako Tomihisa and Miyuki Ito for their assistance with the collection and recording of data in the registers.",analysis;data;statistical
Obes_Facts/PMC5644885.nxml,We are grateful to Ronny Kuhnert and Stefan Dahm from the Department of Epidemiology and Health Monitoring of the Robert Koch Institute in Berlin for statistical support.,statistical
Obes_Facts/PMC5644874.nxml,We thank Prof. Antonella Zambon and Dr. Davide Soranna for statistical analysis.,analysis;statistical
Obes_Facts/PMC5644877.nxml,"We thank Philipp Ruth, Irmgard Rose, and Thomas Brettreich from the almeda GmbH for providing data as well as for all the help concerning data handling and interpretation.",data
Obes_Facts/PMC5644877.nxml,"Furthermore, many thanks to Dr. Wolfgang Reuter from the ERGO insurance AG Holding and to the Deutsche Krankenversicherung (DKV) for giving us the opportunity to analyze the data.",data
Obes_Facts/PMC5644877.nxml,"Furthermore, we thank Dr. Kurt Gedrich and Ina C Rondak for statistical advice.",statistical
Obes_Rev/PMC4237119.nxml,Rafael Perera advised on statistical methods.,statistical
Obes_Rev/PMC4819691.nxml,"We would also like to acknowledge the contributions of: Dr Kirsten Corder (Investigator Scientist at MRC Epidemiology Unit) for her help screening the extracted data, and Stephen Sharp (Senior Statistician at MRC Epidemiology Unit) for his assistance in the meta‐analysis.",data
Obes_Rev/PMC5656815.nxml,"The authors thank Isla Kuhn from the University of Cambridge Medical Library who provided advice and assistance with the literature searches and Stephen Sharp of the MRC Epidemiology Unit, University of Cambridge who provided statistical advice.",statistical
Obes_Sci_Pract/PMC5043465.nxml,Christine Petrin completed the data analysis and wrote the manuscript.,analysis;data
Obes_Sci_Pract/PMC5043485.nxml,K. R. and J. M. J. conceived the study design.,design
Obes_Sci_Pract/PMC5043485.nxml,J. M. J. carried out data collection.,data
Obes_Sci_Pract/PMC5043485.nxml,W. L. assisted with conducting the data analysis.,analysis;data
Obes_Sci_Pract/PMC5043510.nxml,"John McGready and Gayene Yenokyan from the Johns Hopkins Bloomberg School of Public Health, Department of Biostatistics, for their help with data analysis.",analysis;data
Obes_Sci_Pract/PMC5192543.nxml,The authors wish to thank Jim Napora and the staff of the Comparative Medicine facility at Amylin Pharmaceuticals for assistance with animal husbandry and care.,animal
Obes_Sci_Pract/PMC5064622.nxml,We thank Dr. Jeanne M. Clark for her assistance with project design and data analysis.,analysis;data;design
Obes_Sci_Pract/PMC5063171.nxml,"The authors thank Richard Patterson, PhD candidate in the Department of Policy Analysis and Management at Cornell University, for assistance with data analyses.",analyses;analysis;data
Obes_Sci_Pract/PMC5067555.nxml,"We are extremely grateful to Dr Leslie Smith, DNP, RN, Senior Information Analytics Specialist, Quality Research Institute, Sentara Healthcare who provided us with the de‐identified data files and ran the queries that enabled us to make this study possible.",data
Obes_Sci_Pract/PMC5069573.nxml,"We also thank Junji Kishimoto, PhD, for his contribution to the statistical analysis and Ayako Tomihisa and Miyuki Ito for their assistance with the collection and recording of the data in the registers.",analysis;data;statistical
Obes_Sci_Pract/PMC5089573.nxml,"We thank E. Roman, A. Calixto and G. Ferraz for technical assistance and H. Ceretta for statistical analysis.",analysis;statistical
Obes_Sci_Pract/PMC5089573.nxml,"E. P. Araujo, M. H. Melo Lima and L. A. Velloso were responsible for data analysis.",analysis;data
Obes_Sci_Pract/PMC5192533.nxml,"The authors thank Jahdai Dawes, Marsha Turner, and Terry Ervin, RN for assistance with recruitment and conducting measurements; Elizabeth Strawbridge, MPH, RD, and Leslie Gaillard, RD, for delivery of the weight loss intervention; and Lesa Powell and Aviel Alkon for programming and database development.",delivery
Obes_Sci_Pract/PMC5358077.nxml,"The authors wish to thank Joseph Nadglowski, James Zervios and Lindsay McGhay at the OAC for their assistance in distributing the survey and compiling internal membership data, and members of the OAC who participated in this study.",data
Obes_Sci_Pract/PMC5358073.nxml,"Our appreciation is extended to the women who participated in this study, John Sorkin, MD, PhD, for statistical consultation and the nurses, exercise physiologists, and registered dietitians for their assistance.",statistical
Obes_Sci_Pract/PMC5358072.nxml,We sincerely appreciate Tinuke Oluyomi Daniel and Colleen K. Kilanowski for feedback on study design and Troy Tine Kong and Alyssa Melber for assisting in material preparation.,design
Obes_Sci_Pract/PMC5478810.nxml,"Stacie Swanton carried out the literature search, study design and data analysis and generated the tables and figures.",analysis;data;design
Obes_Sci_Pract/PMC5478810.nxml,"Matthew Peterson, Audrey Choh, Miryoung Lee and Stefan Czerwinski conceived the study design, data analysis and data interpretation.",analysis;data;design
Obes_Sci_Pract/PMC5478801.nxml,"Authors E. W., A. S., L. P., F. S., J. H., A. H., R. W. and J. D. were involved in the conception and design of the study.",design
Obes_Sci_Pract/PMC5523699.nxml,"The study could not have been completed without the administrative support of Kristin Serodio and the staff at each of the Wharton Medical Clinic‐Weight Management Centres, as well as the help of the York University volunteer students, Dr. Chris Ardern, PhD for reviewing the manuscript and Dr. Michael Rotondi, PhD for providing his statistical expertise.",statistical
Obes_Sci_Pract/PMC5523698.nxml,"The authors thank Dr. Christine Hoehner, Dr. Elizabeth Dodson, and the Health and Behavioral Risk Research Center (HBRRC) at the University of Missouri‐Columbia School of Medicine for their efforts with survey development and data collection.",data
Obes_Sci_Pract/PMC5729491.nxml,"I thank Brian Nosek for his feedback on the experimental design, N. Sriram for his assistance with the code and Mazharin Banaji for her comments on an earlier version of the manuscript.",design
Obes_Sci_Pract/PMC5598017.nxml,"We thank Britta Jux and the Clinic for Diagnostic Radiology, University Medical Center Schleswig‐Holstein, Kiel (Germany), for the help with MRI scanning.",scanning
Obes_Sci_Pract/PMC5649738.nxml,The authors thank all the test personnel for their work during the data collection and Professors Ingar M. Holme and Morten W. Fagerland for statistical guidance.,data;statistical
Obes_Sci_Pract/PMC5598021.nxml,"Ginger Carls, Edward Tuttle, Ruo‐Ding Tan and Jason Zhu are employees of Analysis Group, Inc., which has received consultancy fees from Intarcia Therapeutics.",analysis
Obes_Sci_Pract/PMC5598020.nxml,"We wish to acknowledge the contributions of Cassandra Lowe, Dimitar Kolev, Kimberley Luu, Fahd Munir and other members of the Social Neuroscience and Health Lab for their assistance with data collection.",data
Obes_Sci_Pract/PMC5598018.nxml,The author thanks Sarah Adam for her assistance with a part of the data collection.,data
Obes_Sci_Pract/PMC5598019.nxml,"We thank E. Birnie (Franciscus Gasthuis, Rotterdam, The Netherlands) for his help in statistical analysis.",analysis;statistical
Obes_Sci_Pract/PMC5818742.nxml,"Kelly Gonzales was the Principal Investigator (PI), completed all aspects of data collection in the field and served as primary writer and final editor of all drafts of this paper.",data
Obes_Sci_Pract/PMC5818742.nxml,Ginny Garcia completed analysis and reporting of the data and prepared the text for  Methods  and  Results  sections of this paper.,analysis;data
Obes_Sci_Pract/PMC5818742.nxml,"Clemma Mueller, Lonnie Nelson and Spero Manson all played major roles in developing the design of the study, including development of the specific aims, research design and data collection tools and protocols.",data;design
Obes_Sci_Pract/PMC5818738.nxml,"The authors would like to acknowledge the assistance of Alison Teyhan, who provided statistical advice, and Christine Delisle, who provided feedback on language and content.",statistical
Obes_Sci_Pract/PMC5893468.nxml,We also thank Dr. Thomas A. Wadden and Dr. Ronette Kolotkin for their thoughtful input into the design of this study.,design
Obes_Sci_Pract/PMC5478811.nxml,"We would like to thank Sara Kovacs, Meghan McGuire, Robert Kowalsky, Matthew O'Dell, Katherine Collins, Shawn Raybuck, Marissa Marcin, Pat Donahue and Melissa Vendetti for their help with recruitment, data collection, intervention sessions and exercise supervision.",data
Obes_Sci_Pract/PMC6009991.nxml,"In addition, database programmer, Jennifer Andringa, BA; data specialist, Carolyn Powers, BS, RD, CCDM; SAS programmer, Yahong Liu, MS; manager, Rachel Akers, MPH, CCDM; and Director, Eileen King, PhD, with the POWER Data Coordinating Center in the Division of Biostatistics and Epidemiology, CCHMC, have made important contributions to the management of the POWER data.",data
Obes_Sci_Pract/PMC6009988.nxml,"Arrixaca’ University Children's Hospital, University of Murcia, Spain); U Keil* (Institut für Epidemiologie und Sozialmedizin, Universität Münster, Germany); CKW Lai* (Department of Medicine and Therapeutics, The Chinese University of Hong Kong, SAR China); J Mallol* (Department of Paediatric Respiratory Medicine, University of Santiago de Chile, Chile); EA Mitchell (Department of Paediatrics: Child and Youth Health, Faculty of Medical and Health Sciences, The University of Auckland, New Zealand); S Montefort* (Department of Medicine, University of Malta, Malta), J Odhiambo† (Centre Respiratory Diseases Research Unit, Kenya Medical Research Institute, Nairobi, Kenya); N Pearce (Department of Medical Statistics, Faculty Epidemiology and Public Health, London School of Hygiene and Tropical Medicine, London, UK); CF Robertson (Murdoch Children's Research Institute, Melbourne, Australia); AW Stewart (Population Health, Faculty of Medical and Health Sciences, The University of Auckland, New Zealand); D Strachan (Division of Community Health Sciences, St Georges, University of London, London, UK); E von Mutius (Ludwig Maximilians University, Germany); SK Weiland† (Institute of Epidemiology, University of Ulm, Germany); G Weinmayr (Institute of Epidemiology and Medical Biometry, University of Ulm, Germany); H Williams (Centre for Evidence Based Dermatology, Queen's Medical Centre, University Hospital, Nottingham, UK); G Wong (Department of Paediatrics, Prince of Wales Hospital, Hong Kong, SAR China).",statistics
Obes_Sci_Pract/PMC6009989.nxml,"We also acknowledge Peter Hanna, Stephanie Browning and Maie Lee for assistance with data collection and Allison Sypher for assistance with data coding.",data
Obes_Surg/PMC2850994.nxml,We would like to acknowledge the generous contribution of Paul G. Shekelle to the design of our project and critical review of the analysis.,analysis;design
Obes_Surg/PMC3215889.nxml,"We thank Berit Mossing Bjørkås for assisting with sampling and logistics, Line Kristin Johnson for collecting dietary and activity data, and Matthew McGee for proofreading the manuscript.",data
Obes_Surg/PMC3560940.nxml,"We are grateful for expert surgical consultation from M Fried, First Faculty of Medicine, Charles University, Prague, Czech Republic; study advice from K Haas, Medical Education, Ethicon Endo-Surgery, Cincinnati, OH, USA; and statistical consultation from J Jokinen, Johnson & Johnson Consumer Products, Fort Washington, Pennsylvania, USA; and TW McGlennon, Director, Statistical Analysis and Quality of Life Assessment, McGlennon MotiMetrics (M3), WI, USA.",analysis;statistical
Obes_Surg/PMC3671103.nxml,"J. Amrhein is an employee of McDougall Scientific Ltd., which received payment from Allergan for statistical support.",statistical
Obes_Surg/PMC3916703.nxml,"J.N. Buchwald is Director and Chief Scientific Research Writer at Medwrite LLC, Wisconsin, USA, and T.W. McGlennon is Director, Statistical Analysis and Quality of Life Assessment, McGlennon MotiMetrics (M3), Wisconsin, USA, both CROs under contract with Ethicon.",analysis;statistical
Obes_Surg/PMC4274365.nxml,"We thank Dr. Solano (Quirón, Zaragoza) and Dr. Lago (Quirón, Palma de Mallorca) for providing support in data collection and Javier Sánchez for statistical analysis.",analysis;data;statistical
Obes_Surg/PMC4498278.nxml,"Authors thank Ana Turk, MSc for statistical support, Elisabeth Burdukova, MD, MSc, Daniel Adam, MSc, Laura Geissler, MSc and Farhang Modaresi, MD, MSc for support with the surgical volume data and tariff analysis.",analysis;data;statistical
Obes_Surg/PMC4498278.nxml,"Authors also thank Rongrong Zhang, MSc for data collection and Mattias Kyhlstedt for valuable comments.",data
Obes_Surg/PMC4522033.nxml,"The authors want to express their gratitude to the patients for their unselfish collaboration, to Lluis Jover, PhD (Unitat de Bioestadística, Departament de Salut Pública, Universitat de Barcelona) for his expert statistical advice, to John D Brannan, PhD (Sydney, Australia) for his insightful comments, and to Maribel Diaz, PhD (Hospital Clínic), Marc Pino, RT (Hospital Clínic) and Patricia Molina, RT (Hospital Clínic) and Mónica Vilà-Ubach, RT (Hospital del Mar) for the quality of the measurements of systemic and exhaled biomarkers.",statistical
Obes_Surg/PMC4559572.nxml,"We thank Linda Mathisen and Marianne Sæter for their assistance with patient logistics, Morten Fagerland for statistical help, and Matthew McGee for proofreading the manuscript.",statistical
Obes_Surg/PMC5306243.nxml,We would like to thank Dr. Alamgir Khan for his excellent assistance in performing plasma ELISA assays at the Australian Proteome Analysis Facility and the infrastructure provided by the Australian Government through the National Collaborative Research Infrastructure Strategy (NCRIS).,analysis;elisa
Obes_Surg/PMC5339332.nxml,We would also like to thank Ralph Highnam PhD for providing the Volpara software and both Ralph Highnam PhD and Ariane Chan PhD for their helpful feedback and review of the manuscript.,software
Obes_Surg/PMC5339319.nxml,I would like to thank Jelmer Van Den Bossche for his important assistance for the data gathering and Amber Salomons for her assistance in the analyses of the data and for the manuscript preparation.,analyses;data
Obes_Surg/PMC5403843.nxml,Special thanks to Hege Tevik Bjøru for help with recruitment of participants and to Turid Follestad for help regarding statistical analysis.,analysis;statistical
Obes_Surg/PMC5403855.nxml,"We would also like to thank Alexandra Kaider for the statistical input and, last but not least, the bariatric patients who participated in this study.",statistical
Obes_Surg/PMC5403839.nxml,We would like to thank E. Tromp for helping with the data-analysis and O. Tettero for providing the data.,data
Obes_Surg/PMC5423994.nxml,"We are grateful to Florian Klinglmüller from the Medical Statistics Department of the Medical University of Vienna for providing consultancy on statistical analysis issue, to Lilliana Ionasz and Erika Nowotny for their excellent technical assistance in performing the ELISAs, and to Dr. Monika Gräßl for help with recruiting the lean patients.",analysis;statistical;statistics
Obes_Surg/PMC5509820.nxml,"By-Band-Sleeve Trial Management Group: Jane Blazeby (Chief Investigator), University of Bristol; Richard Welbourn (Surgical Lead), Musgrove Park Hospital; James Byrne (Surgical Expertise), Southampton University Hospitals NHS Trust; Barnaby C. Reeves (Methodologist Lead), University of Bristol; Sarah Wordsworth (Health Economics Lead), University of Oxford; Robert C. Andrews (Endocrinology Lead), University of Exeter; Janice L. Thompson (Nutritional Lead), University of Birmingham; Graziella Mazza (Trial Manager), University of Bristol; Chris A. Rogers (Statistical Lead), University of Bristol.",statistical
Obes_Surg/PMC5778170.nxml,"Thank you to Elisabeth Gramatkovski for invaluable help with the iodine analyses, to Stella Nakate for assistance in the WHO MONICA project and to Ass Prof Carl-Johan Behre who established contact with the SOS study group.",analyses
Obes_Surg/PMC6018591.nxml,"The following surgeon also contributed to data collection: Mr. Nicholas Penney, MBBS.",data
Obesity_(Silver_Spring)/PMC3270297.nxml,"We gratefully acknowledge the assistance of consultants and advisory board members for the input into the initial design of the study: Nancy J. Bohannon (California Pacific Medical Center, St Luke's Campus); Arthur Frank (George Washington University, Washington, DC); David G. Orloff (Medpace, Cincinnati, OH); F. Xavier Pi-Sunyer (Columbia University College of Physicians and Surgeons, New York, NY); Donna H. Ryan (Pennington Biomedical Research Center, Baton Rouge, LA); Thomas A. Wadden (University of Pennsylvania School of Medicine, Philadelphia, PA).",design
Obesity_(Silver_Spring)/PMC3270297.nxml,"Finally, we thank Dr Kyle Grimes of the University of Alabama at Birmingham who offered additional editorial comments and Dr Lloyd Edwards of the University of North Carolina, Chapel Hill who checked and confirmed all of our statistical results.",statistical
Obesity_(Silver_Spring)/PMC3981958.nxml,We wish to thank Julie Foley at NIEHS Pathology Core for performing H&E staining on WAT.,staining
Obesity_(Silver_Spring)/PMC3383904.nxml,"We thank Theresa Sikorski and staff at the Freimann Life Science Center, University of Notre Dame, for assistance with animal care.",animal
Obesity_(Silver_Spring)/PMC3428606.nxml,"Appreciation is expressed to Lora G. Roba, Vida Rostami, Lauren Angelucci, Nicole Gens, and Caitlin Hart for data collection and data entry and assisting in the implementation of protocol.",data
Obesity_(Silver_Spring)/PMC3343346.nxml,We thank Trevino Larry for transfer of CT scan data.,data;scan
Obesity_(Silver_Spring)/PMC3346885.nxml,"We would also thank Andrew Cooper, Ji Young Li, Frederick Rademaker and Irene B. Helenowski for their assistance in the statistical analysis of our data.",analysis;data;statistical
Obesity_(Silver_Spring)/PMC3458203.nxml,"Randy Mar, Cameron Hopgood, and the Ottawa Police Service are gratefully acknowledged for the crime data used in this research.",data
Obesity_(Silver_Spring)/PMC3473097.nxml,"We thank Amanda Terry, Kimberly Watson, and Patrick Scanlon for data collection and entry; Dr. Rusan Chen for his statistical guidance; and Ms. Coleen Lucas, Dr. Kirsten Hawkins, and the staff of the Wellness Clinic at H.D Woodson High School in Washington, DC, for participant recruitment and data collection efforts.",data;statistical
Obesity_(Silver_Spring)/PMC4820081.nxml,Rafael Perera advised on statistical methods.,statistical
Obesity_(Silver_Spring)/PMC3500572.nxml,"The authors thank Taren B. Spence, RD for study data collection, Charles DeMarcus Keil for data entry, and VUIIS MR technologists, Robin Avison and Donna Butler, for MR scanning support.",data;scanning
Obesity_(Silver_Spring)/PMC3748182.nxml,"Antony Wright (MRC Epidemiology Unit, Cambridge) is acknowledged for expert advice on the processing of the DLW data.",data
Obesity_(Silver_Spring)/PMC3690173.nxml,"The authors would like to thank Dr Alan Flint (School of Public Health, Harvard University) for his help with the analysis using NHANES data.",analysis;data
Obesity_(Silver_Spring)/PMC3732502.nxml,K. Cianflone holds a Canada Research Chair in Adipose Tissue.,tissue
Obesity_(Silver_Spring)/PMC3732502.nxml,"We also thank Janet Peerson for expert advice on the statistical analysis of the data, and Melanie Cianflone for manuscript preparation.",analysis;data;statistical
Obesity_(Silver_Spring)/PMC3731401.nxml,"We thank Dr. Michael Jensen, Charles Ford, and Jaime Gransee at the Mayo Clinic for assistance with the deuterium analyses, and Dr. Barbara McCloskey at Thomas Jefferson University for assistance with the 25(OH)D assays.",analyses
Obesity_(Silver_Spring)/PMC3692609.nxml,We thank Dr. Louis Aronne for his insightful advice and Dermot Haughey for participation in NMR data analysis.,analysis;data
Obesity_(Silver_Spring)/PMC3484178.nxml,Daniel McConnell  (Central Ligand Assay Satellite Services).,assay
